raw_string,old_ror_name,new_ror_name,reason,chosen_score
"First Teaching Hospital of Tianjin University of Traditional Chinese Medicine, National Clinical Research Center for Chinese Medicine Acupuncture and Moxibustion, Tianjin, 300381, China",First Teaching Hospital of Tianjin University of Traditional Chinese Medicine,Tianjin University of Traditional Chinese Medicine,rule_match_disagree,1.0
"Shanghai Univ Tradit Chinese Med, Peoples Hosp 7, 358 Datong Rd, Shanghai 200137, Peoples R China",Shanghai University,Shanghai University of Traditional Chinese Medicine,rule_match_disagree,0.75
"Shanghai Univ Tradit Chinese Med, Longhua Hosp, Dept Gen Surg, Shanghai 200032, Peoples R China",Shanghai University,Shanghai University of Traditional Chinese Medicine,rule_match_disagree,0.75
"Shanghai Univ Tradit Chinese Med, Longhua Hosp, Inst Digest Dis, China Canada Ctr Res Digest Dis ccCRDD, Shanghai 200032, Peoples R China",Shanghai University,Shanghai University of Traditional Chinese Medicine,rule_match_disagree,1.0
"Shanghai Univ Tradit Chinese Med, State Key Lab Integrat & Innovat Class Formula &, Shanghai 200032, Peoples R China",Shanghai University,Shanghai University of Traditional Chinese Medicine,rule_match_disagree,0.75
"School of Life Sciences, Shanghai University, No.99 Shangda Road, Shanghai, 200444, China",Shanghai University,(unmatched),catch_all_no_rule,1.0
"Shuguang Hospital, Shanghai University of Traditional Chinese Medicine, Shanghai, 201203, China",Shanghai University,Shanghai University of Traditional Chinese Medicine,rule_match_disagree,1.0
"Changchun Univ Chinese Med, Northeast Asia Res Inst Tradit Chinese Med, Changchun 130117, Peoples R China",Changchun University,Changchun University of Chinese Medicine,rule_match_disagree,1.0
"Univ Chinese Acad Sci, Sch Pharm, Beijing 100049, Peoples R China",Changchun University of Chinese Medicine,University of Chinese Academy of Sciences,rule_match_disagree,0.72
"Chinese Acad Sci, Shanghai Inst Mat Med, State Key Lab Drug Res, 501 Haike Rd,Zhangjiang Hi Tech Pk, Shanghai 201203, Peoples R China",State Key Laboratory of Drug Research,Shanghai Institute of Materia Medica,rule_match_disagree,0.88
"Department of Gastrointestinal Surgery of the First Affiliated Hospital of Guangzhou University of Chinese Medicine, Guangzhou, China",First Affiliated Hospital of Guangzhou University of Chinese Medicine,Guangzhou University of Chinese Medicine,rule_match_disagree,1.0
"The First Affiliated Hospital of Guangzhou University of Chinese Medicine, Guangdong Clinical Research Academy of Chinese Medicine, Guangzhou, China",First Affiliated Hospital of Guangzhou University of Chinese Medicine,Guangzhou University of Chinese Medicine,rule_match_disagree,1.0
"Shanghai Univ Tradit Chinese Med, Natl Key Lab Discovery & Utilizat Funct Components, Inst Chinese Mat Med,Shanghai Key Lab Cpd Chinese, Key Lab Standardizat Chinese Med,Minist Educ, Shanghai 201203, ",Shanghai University,Shanghai University of Traditional Chinese Medicine,rule_match_disagree,0.75
"US FDA, Off Clin Pharmacol, Ctr Drug Evaluat & Res, Silver Spring, MD USA",Israel Cancer Association USA,(unmatched),catch_all_no_rule,0.62
"Chinese Acad Sci, Shanghai Inst Mat Med, State Key Lab Drug Res & Nat Prod, Dept Chem, Beijing 100864, Peoples R China",State Key Laboratory of Drug Research,Shanghai Institute of Materia Medica,rule_match_disagree,0.78
"Minist Educ, Key Lab Liver & Kidney Dis, Shanghai 201203, Peoples R China",Shanghai University,(unmatched),catch_all_no_rule,0.75
"Shanghai Key Lab Tradit Chinese Med, Shanghai 201203, Peoples R China",Shanghai University,(unmatched),catch_all_no_rule,0.75
"Shanghai Univ Tradit Chinese Med, Yueyang Hosp Integrated Tradit Chinese & Western M, Prevent Treatment Ctr, Shanghai 200437, Peoples R China",Shanghai University,Shanghai University of Traditional Chinese Medicine,rule_match_disagree,0.75
"Department of Internal Medicine, the First Affiliated Hospital of Zhejiang Chinese Medical University, Zhejiang Province, Hangzhou, 310006, China",The Third Affiliated Hospital of Zhejiang Chinese Medical University,Zhejiang Chinese Medical University,rule_match_disagree,0.95
"12631 E 17TH AVE STE B198 6, Aurora, CO 80045 USA",Israel Cancer Association USA,(unmatched),catch_all_no_rule,0.77
"Shanghai Research Center for TCM Modernization, Shanghai Institute of Materia Medica, Shanghai Institutes for Biological Sciences, Shanghai, 201203, China",Shanghai Institutes for Biological Sciences,Shanghai Institute of Materia Medica,rule_match_disagree,1.0
"Shanghai RandD Centre for Standardization of Chinese Medicines, Shanghai 201210, China",Shanghai University,(unmatched),catch_all_no_rule,0.75
"Shanghai R and D Centre for Standardization of Chinese Medicines, Shanghai 201210, 199 Guoshoujing Road, China",Shanghai University,(unmatched),catch_all_no_rule,0.75
"School of Pharmacy, Second Military Medical University, Shanghai Key Laboratory for Pharmaceutical Metabolites Research, Shanghai, No. 325 Guohe Road, China",Second Military Medical University,Naval Medical University,rule_match_disagree,1.0
"Joint Research Laboratory of Promoting Globalization of Traditional Chinese Medicines between The Chinese University of Hong Kong and Shanghai Institute of Materia Medica, Chinese Academy of Sciences,",Chinese University of Hong Kong,Shanghai Institute of Materia Medica,rule_match_disagree,1.0
"Shanghai Key Laboratory for Pharmaceutical Metabolite Research, School of Pharmacy, Second Military Medical University, Shanghai, 200433, China",Second Military Medical University,Naval Medical University,rule_match_disagree,1.0
"Chinese Acad Sci, Shanghai Inst Mat Med, Natl Engn Lab TCM Standardizat Technol, Shanghai Res Ctr Modernizat Tradit Chinese Med, 501 Haike Rd, Shanghai 201203, Peoples R China",Shanghai University,Shanghai Institute of Materia Medica,rule_match_disagree,0.75
"Guangming Chinese Med Hosp, Pudong New Area Shanghai, Dept Pharm, 43 Dongmen St, Shanghai 201399, Peoples R China",Shanghai University,(unmatched),catch_all_no_rule,0.75
"Shanghai Univ Med & Hlth Sci, Affiliated Peoples Hosp East Campus 6, Dept Pharm, 222 HuanhuXisan Rd, Shanghai 201306, Peoples R China",Shanghai University,(unmatched),catch_all_no_rule,0.75
"School of Pharmacy, TCM and Ethnomedicine Innovation & Development International Laboratory, Innovative Materia Medica Research Institute, Hunan University of Chinese Medicine, Changsha, 410208, China",Hebei University of Chinese Medicine,Hunan University of Chinese Medicine,rule_match_disagree,0.89
"Shanghai TCM-Integrated Hospital, Shanghai University of Traditional Chinese Medicine, 230 Baoding Road, Shanghai, 200082, China",Shanghai University,Shanghai University of Traditional Chinese Medicine,rule_match_disagree,1.0
"Longhua Hospital Affiliated to Shanghai University of Traditional Chinese Medicine, Shanghai, 200032, China",Second Affiliated Hospital of Hunan University of Traditional Chinese Medicine,Shanghai University of Traditional Chinese Medicine,rule_match_disagree,0.83
"Shanghai Univ Tradit Chinese Med, Sch Chinese Mat Med, Shanghai 201203, Peoples R China",Shanghai University,Shanghai University of Traditional Chinese Medicine,rule_match_disagree,0.75
"Shanghai Univ Tradit Chinese Med, Shanghai Yueyang Integrated Tradit Chinese Med & W, Shanghai 200437, Peoples R China",Shanghai University,Shanghai University of Traditional Chinese Medicine,rule_match_disagree,0.75
"Shanghai Univ Tradit Chinese Med, Longhua Hosp, Inst Chinese Tradit Surg, Shanghai 200032, Peoples R China",Shanghai University,Shanghai University of Traditional Chinese Medicine,rule_match_disagree,1.0
"Department of Gynecology, Beijing University of Chinese Medicine Third Affiliated Hospital, Beijing, 100029, China",Beijing University of Technology,Beijing University of Chinese Medicine,rule_match_disagree,0.78
"Austar Hansen Lifesci Shanghai Ltd, Shanghai 200050, Peoples R China",Shanghai University,(unmatched),catch_all_no_rule,0.75
"Herbal Synergy, Oakland, CA USA",Israel Cancer Association USA,(unmatched),catch_all_no_rule,0.92
"Department of Pediatrics, Affiliated Hospital of Liaoning University of Traditional Chinese Medicine, Shenyang, 110032, China",Affiliated Hospital of Liaoning University of Traditional Chinese Medicine,Liaoning University of Traditional Chinese Medicine,rule_match_disagree,1.0
"TCM and Ethnomedicine Innovation & Development International Laboratory, Innovative Materia Medica Research Institute, School of Pharmacy, Hunan University of Chinese Medicine, Changsha, China",Hebei University of Chinese Medicine,Hunan University of Chinese Medicine,rule_match_disagree,0.89
"Nanjing Univ Chinese Med, Comprehens Canc Ctr, Nanjing Drum Tower Hosp, Clin Coll, Nanjing, Peoples R China",Nanjing Drum Tower Hospital,Nanjing University of Chinese Medicine,rule_match_disagree,0.92
"Department of Pharmacology, Institute of Drug Research, Shanghai Second Medical University, Shanghai 200025, 280 South Chongqing Road, China",Shanghai University,(unmatched),catch_all_no_rule,0.75
"UIC Coll Pharm, Dept Med Chem & Pharmacognosy MC 781, Chicago, IL 60612 USA",Israel Cancer Association USA,(unmatched),catch_all_no_rule,0.77
"Shandong University of Traditional Chinese Medicine, 4655 Daxue Road, Jinan, 250355, Shandong, China",Shandong University,Shandong University of Traditional Chinese Medicine,rule_match_disagree,1.0
"Shanghai Univ Tradit Chinese Med, Sch Rehabil Sci, Shanghai, Peoples R China",Shanghai University,Shanghai University of Traditional Chinese Medicine,rule_match_disagree,0.67
"Shanghai Univ Tradit Chinese Med, Yueyang Hosp Integrated Tradit Chinese & Western, Shanghai 200473, Peoples R China",Shanghai University,Shanghai University of Traditional Chinese Medicine,rule_match_disagree,0.75
"Shanghai Univ Tradit Chinese Med, Ctr Tradit Chinese Med & Immunol Res, Sch Basic Med Sci, Shanghai, Peoples R China",Shanghai University,Shanghai University of Traditional Chinese Medicine,rule_match_disagree,0.67
"Hunan Univ Chinese Med, Mol Pathol Lab, Hunan Prov Key Lab Prevent & Treatment Integrated, Sch Med, 300 Xueshi Rd,Hanpu Sci & Technol Pk, Changsha 410208, Hunan, Peoples R China",Hunan University of Traditional Chinese Medicine,Hunan University of Chinese Medicine,rule_match_disagree,0.74
"Cardiovascular Department, Shuguang Hospital of Shanghai University of Traditional Chinese Medicine, Shanghai, 201203, China",Second Affiliated Hospital of Hunan University of Traditional Chinese Medicine,Shanghai University of Traditional Chinese Medicine,rule_match_disagree,0.85
"Cardiovascular Research Institute of Traditional Chinese Medicine, Shuguang Hospital of Shanghai University of Traditional Chinese Medicine, Shanghai, 201203, China",Jiangxi Provincial Institute of Traditional Chinese Medicine,Shanghai University of Traditional Chinese Medicine,rule_match_disagree,0.88
"Department of Liver Diseases, Shuguang Hospital Affiliated to Shanghai University of Traditional Chinese Medicine, Shanghai, China",Second Affiliated Hospital of Hunan University of Traditional Chinese Medicine,Shanghai University of Traditional Chinese Medicine,rule_match_disagree,0.83
"Laboratory of Cellular Immunity, Shuguang Hospital Affiliated to Shanghai University of Traditional Chinese Medicine, Shanghai, China",Second Affiliated Hospital of Hunan University of Traditional Chinese Medicine,Shanghai University of Traditional Chinese Medicine,rule_match_disagree,0.83
"Central Laboratory, Shuguang Hospital Affiliated to Shanghai University of Traditional Chinese Medicine, Shanghai, China",Second Affiliated Hospital of Hunan University of Traditional Chinese Medicine,Shanghai University of Traditional Chinese Medicine,rule_match_disagree,0.83
"Institute of Infectious Disease, Shuguang Hospital Affiliated to Shanghai University of Traditional Chinese Medicine, Shanghai, China",Second Affiliated Hospital of Hunan University of Traditional Chinese Medicine,Shanghai University of Traditional Chinese Medicine,rule_match_disagree,0.83
"Tianjin Nankai Hospital, No. 6 Changjiang Road, Nankai District. Huimin Liu, Rui Han, Department of School of Chinese Medicine, Tianjin University of Traditional Chinese Medicine, No.10, Poyang Lake R",Tianjin Nankai Hospital,Tianjin University of Traditional Chinese Medicine,rule_match_disagree,1.0
"School of Acupuncture-Moxibustion and Tuina, Shanghai University of Traditional Chinese Medicine, Shanghai, 201203, China",Shanghai University,Shanghai University of Traditional Chinese Medicine,rule_match_disagree,1.0
"Naval Med Univ, Sch Pharm, Shanghai 200433, Peoples R China",Shanghai University,Naval Medical University,rule_match_disagree,0.75
"Nephropathy Department, Affiliated Hospital of Shandong University of Traditional Chinese Medicine, Jinan, 250014, China",Affiliated Hospital of Shandong University of Traditional Chinese Medicine,Shandong University of Traditional Chinese Medicine,rule_match_disagree,1.0
"School of Pharmacy, University of Chinese Academy of Sciences, Chinese Academy of Sciences, Shanghai, 201203, China",Chinese Academy of Sciences,University of Chinese Academy of Sciences,rule_match_disagree,1.0
"Affiliated Hospital of Nanjing University of Chinese Medicine (Jiangsu Province Hospital of Chinese Medicine), No.155, Hanzhong Road, Jiangsu Province, Nanjing, 210029, China",Jiangsu Province Hospital,Nanjing University of Chinese Medicine,rule_match_disagree,1.0
"Academy of Chinese Medical Sciences, Hunan University of Chinese Medicine, Hunan, Changsha, 410208, China",China Academy of Chinese Medical Sciences,Hunan University of Chinese Medicine,rule_match_disagree,0.92
"School of Chinese Medicine, Hunan University of Chinese Medicine, Hunan, Changsha, 410208, China",Hebei University of Chinese Medicine,Hunan University of Chinese Medicine,rule_match_disagree,0.89
"School of Integrated Traditional Chinese and Western Medicine, Hunan University of Chinese Medicine, Hunan, Changsha, 410208, China",Hebei University of Chinese Medicine,Hunan University of Chinese Medicine,rule_match_disagree,0.89
"Hunan Provincial Key Laboratory of TCM Diagnostics, Hunan University of Chinese Medicine, Hunan, Changsha, 410208, China",Hunan University,Hunan University of Chinese Medicine,rule_match_disagree,1.0
"VA Med Ctr, San Diego, CA 92161 USA",Israel Cancer Association USA,(unmatched),catch_all_no_rule,0.92
"Shanghai Engineer & Technol Res Ctr Reprod Hlth D, Shanghai Inst Planned Parenthood Res, Key Lab Contracept & Devices Res NPFPC, Shanghai 200032, Peoples R China",Shanghai University,(unmatched),catch_all_no_rule,0.75
"Council Responsible Nutr Int, Washington, DC USA",Israel Cancer Association USA,(unmatched),catch_all_no_rule,0.77
"NTP NIEHS, Res Triangle Pk, NC USA",Israel Cancer Association USA,(unmatched),catch_all_no_rule,0.77
"Shandong Univ Tradit Chinese Med, Res Inst Marine Tradit Chinese Med, Qingdao 266112, Peoples R China",MED Institute,Shandong University of Traditional Chinese Medicine,rule_match_disagree,0.85
"Univ Chinese Acad Sci, Beijing 100039, Peoples R China",Changchun University of Chinese Medicine,University of Chinese Academy of Sciences,rule_match_disagree,0.72
"Shanghai Univ Tradit Chinese Med, Shanghai 20071, Peoples R China",Shanghai University,Shanghai University of Traditional Chinese Medicine,rule_match_disagree,0.73
"Council Responsible Nutr, Washington, DC USA",Israel Cancer Association USA,(unmatched),catch_all_no_rule,0.77
"US FDA, Silver Spring, MD USA",Israel Cancer Association USA,(unmatched),catch_all_no_rule,0.62
"NSF Int, Ann Arbor, MI USA",Israel Cancer Association USA,(unmatched),catch_all_no_rule,0.77
"Natl Inst Environm Hlth Sci, Div Translat Toxicol, Res Triangle Pk, NC USA",Israel Cancer Association USA,(unmatched),catch_all_no_rule,0.77
"Jefferson Einstein Med Ctr, Dept Med, Philadelphia, PA USA",Israel Cancer Association USA,(unmatched),catch_all_no_rule,0.77
"Shanghai Univ Tradit Chinese Med, E Inst Shanghai Municipal Educ Commiss, Shanghai 200032, Peoples R China",Shanghai University,Shanghai University of Traditional Chinese Medicine,rule_match_disagree,1.0
"Shanghai Univ Tradit Chinese Med, Longhua Hosp, Inst Digest Dis, Shanghai 200032, Peoples R China",Shanghai University,Shanghai University of Traditional Chinese Medicine,rule_match_disagree,1.0
"Shanghai Univ Tradit Chinese Med, Longhua Hosp, Dept Gastroenterol, Shanghai 200032, Peoples R China",Shanghai University,Shanghai University of Traditional Chinese Medicine,rule_match_disagree,0.75
"Modern Research Center for Traditional Chinese Medicine, Second Military Medical University, Shanghai 200433, China",Second Military Medical University,Naval Medical University,rule_match_disagree,1.0
"Department of Pharmacy, Changzheng Hospital, Second Military Medical University, Shanghai 200003, China",Second Military Medical University,Naval Medical University,rule_match_disagree,1.0
"Department of Pharmacognosy, School of Pharmacy, Second Military Medical University, Shanghai 200433, China",Second Military Medical University,Naval Medical University,rule_match_disagree,1.0
"School of Pharmacy, Heilongjiang University of Chinese Medicine, Key Laboratory of Medicinal Materials, Chinese Academy of Sciences, Harbin, 150040, China",Chinese Academy of Sciences,Heilongjiang University of Chinese Medicine,rule_match_disagree,1.0
"Shanghai Univ Tradit Chinese Med, Longhua Hosp, Dept Pharm, Shanghai 200032, Peoples R China",Shanghai University,Shanghai University of Traditional Chinese Medicine,rule_match_disagree,0.75
"Shanghai Univ Tradit Chinese Med, Dept Chem, Coll Pharm, Shanghai 200444, Peoples R China",Shanghai University,Shanghai University of Traditional Chinese Medicine,rule_match_disagree,0.75
"Shanghai Univ Tradit Chinese Med, Sch Pharm, Shanghai 201203, Peoples R China",Shanghai University,Shanghai University of Traditional Chinese Medicine,rule_match_disagree,0.75
"Natl Ctr Adv Translat Sci, NIH, Rockville, MD 20850 USA",Israel Cancer Association USA,(unmatched),catch_all_no_rule,0.62
"Shanghai Univ Tradit Chinese Med, Ctr Chinese Med Therapy & Syst Biol, Shanghai, Peoples R China",Shanghai University,Shanghai University of Traditional Chinese Medicine,rule_match_disagree,0.67
"Department of Clinical Pharmacology, Affiliated Hospital of Nanjing University of Chinese Medicine, Nanjing 210093, China",Nanjing University,Nanjing University of Chinese Medicine,rule_match_disagree,1.0
"Shanghai Univ Tradit Chinese Med, Inst E, Shanghai 201203, Peoples R China",Shanghai University,Shanghai University of Traditional Chinese Medicine,rule_match_disagree,1.0
"Chinese Acad Sci, Shanghai Inst Mat Med, NMR Lab, Shanghai 201203, Peoples R China",Shanghai University,Shanghai Institute of Materia Medica,rule_match_disagree,0.75
"Chinese Acad Sci, Shanghai Inst Mat Med, State Key Lab Drug Res, Div Antitumor Pharmacol, Shanghai 201203, Peoples R China",State Key Laboratory of Drug Research,Shanghai Institute of Materia Medica,rule_match_disagree,0.88
"First Affiliated Hospital of Guangzhou University of Chinese Medicine, Guangzhou, 510405, China",First Affiliated Hospital of Guangzhou University of Chinese Medicine,Guangzhou University of Chinese Medicine,rule_match_disagree,1.0
"SPH Xing Ling Sci & Tech Pharmaceut Co Ltd, Shanghai 201703, Peoples R China",Shanghai University,(unmatched),catch_all_no_rule,0.75
"Univ Chinese Acad Sci, Sch Pharm, Shanghai 201203, Peoples R China",Shanghai University,University of Chinese Academy of Sciences,rule_match_disagree,0.75
"Univ Calif Berkeley, Dept Chem & Biomol Engn, Berkeley, CA 94720 USA",Israel Cancer Association USA,(unmatched),catch_all_no_rule,0.92
"Univ Calif Berkeley, Calif Inst Quantitat Biosci QB3, Berkeley, CA 94720 USA",Israel Cancer Association USA,(unmatched),catch_all_no_rule,0.92
"Univ Calif Berkeley, Dept Plant & Microbial Biol, Berkeley, CA 94720 USA",Israel Cancer Association USA,(unmatched),catch_all_no_rule,0.92
"Univ Calif Berkeley, Dept Bioengn, Berkeley, CA 94720 USA",Israel Cancer Association USA,(unmatched),catch_all_no_rule,0.92
"E-institute of Shanghai Municipal Education Commission, Shanghai University of Traditional Chinese Medicine, Shanghai, 201203, China",Shanghai University,Shanghai University of Traditional Chinese Medicine,rule_match_disagree,1.0
"Department of Pediatrics, Affiliated Hospital of Nanjing University of Chinese Medicine, Nanjing, China",Nanjing University,Nanjing University of Chinese Medicine,rule_match_disagree,1.0
"The Affiliated Hospital to Changchun University of Chinese Medicine, Changchun, 130117, China",Changchun University,Changchun University of Chinese Medicine,rule_match_disagree,1.0
"School of Clinical Medicine, Xiyuan Hospital, Beijing University of Chinese Medicine, Beijing, China",Xiyuan Hospital,Beijing University of Chinese Medicine,rule_match_disagree,1.0
"US Pharmacopeia Bot Dietary Supplement & Herbal M, Rockville, MD USA",Israel Cancer Association USA,(unmatched),catch_all_no_rule,0.62
Second Military Medical University,Second Military Medical University,Naval Medical University,rule_match_disagree,1.0
"US FDA, Off Clin Pharmacol, Ctr Drug Evaluat & Res, Silver Spring, MD 20993 USA",Israel Cancer Association USA,(unmatched),catch_all_no_rule,0.62
"Hunan Univ Chinese Med, Sch Pharm, Changsha, Peoples R China",Hunan University of Traditional Chinese Medicine,Hunan University of Chinese Medicine,rule_match_disagree,0.74
"Naval Med Univ, Chang Zheng Hosp, Dept Neurosurg, Shanghai, Peoples R China",Chang Gung Memorial Hospital,Naval Medical University,rule_match_disagree,0.62
"Naval Med Univ, Eastern Hepatobiliary Surg Hosp, Clin Res Inst, Shanghai, Peoples R China",Eastern Hepatobiliary Surgery Hospital,Naval Medical University,rule_match_disagree,0.9
"Central laboratory, Putuo Hospital, Shanghai University of Traditional Chinese Medicine, Shanghai, China",Shanghai University,Shanghai University of Traditional Chinese Medicine,rule_match_disagree,1.0
"GlaxoSmithKline, Dept Drug Metab & Pharmacokinet, Collegeville, PA 19426 USA",Israel Cancer Association USA,(unmatched),catch_all_no_rule,0.77
"Hunan Univ Chinese Med, Sch Acupuncture Moxibust & Tuina, Changsha, Peoples R China",Hunan University of Traditional Chinese Medicine,Hunan University of Chinese Medicine,rule_match_disagree,0.74
"Second Mil Med Univ, Eastern Hepatobiliary Surg Hosp, Biliary Tract Surg Dept 1, 225 Changhai Rd, Shanghai 200430, Peoples R China",Eastern Hepatobiliary Surgery Hospital,Naval Medical University,rule_match_disagree,0.9
"Second Mil Med Univ, Eastern Hepatobiliary Surg Hosp, Dept Pharm, Shanghai, Peoples R China",Eastern Hepatobiliary Surgery Hospital,Naval Medical University,rule_match_disagree,0.9
"Department of Cardiology, Institute of Cardiovascular Disease of Integrated Traditional Chinese Medicine and Western Medicine, Shuguang Hospital affiliated to Shanghai University of Traditional Chines",Second Affiliated Hospital of Hunan University of Traditional Chinese Medicine,Shanghai University of Traditional Chinese Medicine,rule_match_disagree,0.83
"Hunan Univ Chinese Med, Affiliated Hosp 1, Changsha, Hunan, Peoples R China",Hunan University of Traditional Chinese Medicine,Hunan University of Chinese Medicine,rule_match_disagree,0.74
"Hunan Univ Chinese Med, Sci & Technol Innovat Ctr, 300 Xueshi Road,Hanpu Sci & Educ Pk, Changsha, Hunan, Peoples R China",Hunan University of Traditional Chinese Medicine,Hunan University of Chinese Medicine,rule_match_disagree,0.74
"Department of Endocrine, Seventh People’s Hospital of Shanghai University of Traditional Chinese Medicine, Shanghai, China",Seventh People's Hospital of Shanghai,Shanghai University of Traditional Chinese Medicine,rule_match_disagree,1.0
"Hlth & Environm Sci Inst, 740 15th St NW, Washington, DC 20005 USA",Israel Cancer Association USA,(unmatched),catch_all_no_rule,0.77
"Shanghai Univ Tradit Chinese Med, Minist Educ, Engn Res Ctr Modern Preparat Technol TCM, Shanghai, Peoples R China",Shanghai University,Shanghai University of Traditional Chinese Medicine,rule_match_disagree,0.67
"Shanghai Univ Tradit Chinese Med, Dept Pharmacol, Sch Pharm, Cai Lun Rd 1200, Shanghai 201203, Peoples R China",Shanghai University,Shanghai University of Traditional Chinese Medicine,rule_match_disagree,0.75
"Shanghai Univ Tradit Chinese Med, Dept Chinese Mat Med, Shanghai, Peoples R China",Shanghai University,Shanghai University of Traditional Chinese Medicine,rule_match_disagree,0.67
"Ctr Drug Evaluat & Res Food & Drug Adm, Bot Review Team, Off New Drug Prod, Off Pharmaceut Qual, Silver Spring, MD USA",Israel Cancer Association USA,(unmatched),catch_all_no_rule,0.62
"Univ MS, Natl Ctr Nat Prod Res, Sch Pharm, University, MS 38677 USA",Israel Cancer Association USA,(unmatched),catch_all_no_rule,0.62
"Univ MS, Natl Ctr Nat Prod Res, Sch Pharm, University, MS USA",Israel Cancer Association USA,(unmatched),catch_all_no_rule,0.62
"Wiley Blackwell, Malden, MA USA",Israel Cancer Association USA,(unmatched),catch_all_no_rule,0.77
"Natl Inst Environm Hlth Sci, Div Translat Toxicol, Durham, NC USA",Israel Cancer Association USA,(unmatched),catch_all_no_rule,0.77
"Bayer Consumer Healthcare, Whippany, NJ USA",Israel Cancer Association USA,(unmatched),catch_all_no_rule,0.62
"Joint Laboratory for Translational Cancer Research of Chinese Medicine, The Ministry of Education of the People’s Republic of China, International Institute for Translational Chinese Medicine, Guangzh",Ministry of Education of the People's Republic of China,Guangzhou University of Chinese Medicine,rule_match_disagree,1.0
"PhalanxBio Inc, Palo Alto, CA USA",Israel Cancer Association USA,(unmatched),catch_all_no_rule,0.92
"Chengdu Univ Tradit Chinese Med, Inst Herbgenom, Chengdu 611137, Peoples R China",Chengdu University,Chengdu University of Traditional Chinese Medicine,rule_match_disagree,1.0
