raw_string,old_ror_name,new_ror_name,reason,chosen_score
"School of Pharmacy, Second Military Medical University, Shanghai, 200433, China",Second Military Medical University,Naval Medical University,rule_match_disagree,1.0
"Second Mil Med Univ, Changzheng Hosp, Dept Pharm, Shanghai 200003, Peoples R China",Shanghai University,Naval Medical University,rule_match_disagree,0.75
"Chinese Acad Sci, Shanghai Inst Mat Med, State key Lab Drug Res, Shanghai 201203, Peoples R China",State Key Laboratory of Drug Research,Shanghai Institute of Materia Medica,rule_match_disagree,0.88
"Univ Chinese Acad Sci, Beijing 100049, Peoples R China",Changchun University of Chinese Medicine,University of Chinese Academy of Sciences,rule_match_disagree,0.72
"School of Pharmacy, Second Military Medical University, Shanghai, China",Second Military Medical University,Naval Medical University,rule_match_disagree,1.0
"Shanghai Univ Tradit Chinese Med, Inst Interdisciplinary Integrat Med Res, Shanghai 201203, Peoples R China",Shanghai University,Shanghai University of Traditional Chinese Medicine,rule_match_disagree,1.0
"Shanghai Univ Tradit Chinese Med, Shanghai 201203, Peoples R China",Shanghai University,Shanghai University of Traditional Chinese Medicine,rule_match_disagree,0.75
"Guangzhou Univ Chinese Med, Int Inst Translat Chinese Med, Guangzhou 510006, Guangdong, Peoples R China",Guangzhou University,Guangzhou University of Chinese Medicine,rule_match_disagree,1.0
"Shanghai Univ Tradit Chinese Med, Inst Interdisciplinary Med, Shanghai 201203, Peoples R China",Shanghai University,Shanghai University of Traditional Chinese Medicine,rule_match_disagree,1.0
"Shanghai Univ Tradit Chinese Med, Inst Interdisciplinary Integrat Med Res, Shanghai, Peoples R China",Shanghai University,Shanghai University of Traditional Chinese Medicine,rule_match_disagree,1.0
"Shanghai Univ Tradit Chinese Med, Sch Pharm, Dept Pharmacol, Shanghai 201203, Peoples R China",Shanghai University,Shanghai University of Traditional Chinese Medicine,rule_match_disagree,0.75
"LongHua Hospital, Shanghai University of Traditional Chinese Medicine, Shanghai, 200032, China",Shanghai University,Shanghai University of Traditional Chinese Medicine,rule_match_disagree,1.0
"Univ Chinese Acad Sci, Beijing, Peoples R China",Changchun University of Chinese Medicine,University of Chinese Academy of Sciences,rule_match_disagree,0.72
"Chinese Acad Sci, Shanghai Inst Mat Med, State Key Lab Drug Res, Shanghai, Peoples R China",State Key Laboratory of Drug Research,Shanghai Institute of Materia Medica,rule_match_disagree,0.88
"School of Pharmacy, Shanghai University of Traditional Chinese Medicine, Shanghai, China",Shanghai University,Shanghai University of Traditional Chinese Medicine,rule_match_disagree,1.0
"Institute of Liver Diseases, Shuguang Hospital Affiliated to Shanghai University of Traditional Chinese Medicine, Shanghai, China",Second Affiliated Hospital of Hunan University of Traditional Chinese Medicine,Shanghai University of Traditional Chinese Medicine,rule_match_disagree,0.83
"Jilin Ginseng Academy, Changchun University of Chinese Medicine, Changchun, China",Changchun University,Changchun University of Chinese Medicine,rule_match_disagree,1.0
"Second Mil Med Univ, Sch Pharm, Shanghai 200433, Peoples R China",Shanghai University,Naval Medical University,rule_match_disagree,0.75
"Guangzhou Univ Chinese Med, Inst Clin Pharmacol, Guangzhou 510405, Guangdong, Peoples R China",Guangzhou University,Guangzhou University of Chinese Medicine,rule_match_disagree,1.0
"First Teaching Hospital of Tianjin University of Traditional Chinese Medicine, Tianjin, 300193, China",First Teaching Hospital of Tianjin University of Traditional Chinese Medicine,Tianjin University of Traditional Chinese Medicine,rule_match_disagree,1.0
"Shanghai Univ Tradit Chinese Med, Shuguang Hosp, Inst Liver Dis, Shanghai 201203, Peoples R China",Shanghai University,Shanghai University of Traditional Chinese Medicine,rule_match_disagree,1.0
"School of Pharmacy, Shanghai University of Traditional Chinese Medicine, Shanghai, 201203, China",Shanghai University,Shanghai University of Traditional Chinese Medicine,rule_match_disagree,1.0
"Longhua Hospital, Shanghai University of Traditional Chinese Medicine, Shanghai, China",Shanghai University,Shanghai University of Traditional Chinese Medicine,rule_match_disagree,1.0
"Univ Chinese Acad Sci, Shanghai 201203, Peoples R China",Shanghai University,University of Chinese Academy of Sciences,rule_match_disagree,0.75
"Chinese Acad Sci, Shanghai Inst Mat Med, Shanghai 201203, Peoples R China",Shanghai University,Shanghai Institute of Materia Medica,rule_match_disagree,0.75
"First Teaching Hospital of Tianjin University of Traditional Chinese Medicine, Tianjin, China",First Teaching Hospital of Tianjin University of Traditional Chinese Medicine,Tianjin University of Traditional Chinese Medicine,rule_match_disagree,1.0
"Shanghai Univ Tradit Chinese Med, Shanghai, Peoples R China",Shanghai University,Shanghai University of Traditional Chinese Medicine,rule_match_disagree,0.67
"Shanghai Univ Tradit Chinese Med, Pharmacokinet Lab, Shanghai 201203, Peoples R China",Shanghai University,Shanghai University of Traditional Chinese Medicine,rule_match_disagree,0.75
"Department of Pharmacy, Affiliated Hospital of Nanjing University of Chinese Medicine, Nanjing, China",Nanjing University,Nanjing University of Chinese Medicine,rule_match_disagree,1.0
"Affiliated Hospital of Nanjing University of Chinese Medicine, Nanjing, China",Nanjing University,Nanjing University of Chinese Medicine,rule_match_disagree,1.0
"Department of Phytochemistry, School of Pharmacy, Second Military Medical University, Shanghai, China",Second Military Medical University,Naval Medical University,rule_match_disagree,1.0
"Interdisciplinary Science Research Institute, Shanghai University of Traditional Chinese Medicine, Shanghai, China",Shanghai University,Shanghai University of Traditional Chinese Medicine,rule_match_disagree,1.0
"The first Affiliated Hospital of Zhejiang Chinese Medical University, Hangzhou, China",First Affiliated Hospital Zhejiang University,Zhejiang Chinese Medical University,rule_match_disagree,0.84
"Millennium Pharmaceut Inc, Cambridge, MA USA",Israel Cancer Association USA,(unmatched),catch_all_no_rule,0.77
"MOE Key Lab Standardizat Chinese Med, Shanghai 201210, Peoples R China",Shanghai University,(unmatched),catch_all_no_rule,0.75
"Western Univ Hlth Sci, Coll Pharm, Ctr Adv Drug Res & Evaluat, Pomona, CA 91766 USA",Israel Cancer Association USA,(unmatched),catch_all_no_rule,0.92
"Shanghai Univ Tradit Chinese Med, Putuo Hosp, Shanghai 200062, Peoples R China",Shanghai University,Shanghai University of Traditional Chinese Medicine,rule_match_disagree,0.75
"The First Affiliated Hospital of Heilongjiang University of Chinese Medicine, Harbin, China",First Affiliated Hospital of Heilongjiang University of Chinese Medicine,Heilongjiang University of Chinese Medicine,rule_match_disagree,1.0
"Guangzhou Univ Chinese Med, Inst Clin Pharmacol, Guangzhou 510405, Peoples R China",Guangzhou University,Guangzhou University of Chinese Medicine,rule_match_disagree,1.0
"Affiliated Hospital of Nanjing University of Chinese Medicine, Jiangsu, Nanjing, China",Nanjing University,Nanjing University of Chinese Medicine,rule_match_disagree,1.0
"Shanghai Univ Tradit Chinese Med, Longhua Hosp, Shanghai, Peoples R China",Longhua Hospital Shanghai University of Traditional Chinese Medicine,Shanghai University of Traditional Chinese Medicine,rule_match_disagree,0.74
"Department of Neurology, Affiliated Hospital of Shandong University of Traditional Chinese Medicine, Shandong Province, Jinan, 250011, China",Shandong University,Shandong University of Traditional Chinese Medicine,rule_match_disagree,1.0
"Shanghai Univ Tradit Chinese Med, Inst Interdisciplinary Integrat Med Res, Shanghai Frontiers Sci Ctr TCM Chem Biol, Shanghai 201203, Peoples R China",Shanghai University,Shanghai University of Traditional Chinese Medicine,rule_match_disagree,1.0
"School of Pharmacy, Hunan University of Chinese Medicine, Hunan, Changsha, 410208, China",Hunan University,Hunan University of Chinese Medicine,rule_match_disagree,1.0
"1200 Cailun Rd, Shanghai 201203, Peoples R China",Shanghai University,(unmatched),catch_all_no_rule,0.75
"Univ Calif San Francisco, Sch Pharm, Dept Clin Pharm, San Francisco, CA 94143 USA",Israel Cancer Association USA,(unmatched),catch_all_no_rule,0.92
"Second Mil Med Univ, Eastern Hepatobiliary Surg Hosp, Dept Pharm, Shanghai 200438, Peoples R China",Eastern Hepatobiliary Surgery Hospital,Naval Medical University,rule_match_disagree,0.9
"Shanghai Univ Tradit Chinese Med, Res Ctr Tradit Chinese Med & Syst Biol, Shanghai 201203, Peoples R China",Shanghai University,Shanghai University of Traditional Chinese Medicine,rule_match_disagree,0.75
"Shanghai Univ Tradit Chinese Med, Res Ctr Tradit Chinese Med Complex Syst, Shanghai 201203, Peoples R China",Shanghai University,Shanghai University of Traditional Chinese Medicine,rule_match_disagree,0.75
"Guangzhou Univ Chinese Med, Interat Inst Translat Chinese Med, Guangzhou 510006, Guangdong, Peoples R China",Guangzhou University,Guangzhou University of Chinese Medicine,rule_match_disagree,1.0
"Shanghai Univ Tradit Chinese Med, Inst Chinese Mat Med, MOE Key Lab Standardizat Chinese Med, Shanghai 201203, Peoples R China",Shanghai University,Shanghai University of Traditional Chinese Medicine,rule_match_disagree,0.75
"Shanghai Univ Tradit Chinese Med, Inst Chinese Mat Med, SATCM Key Lab New Resources & Qual Evaluat Chines, Shanghai 201203, Peoples R China",Shanghai University,Shanghai University of Traditional Chinese Medicine,rule_match_disagree,0.75
"Second Mil Med Univ, Changzheng Hosp, Dept Pharm, Shanghai, Peoples R China",HEC Pharm (China),Naval Medical University,rule_match_disagree,0.74
"Shanghai Univ Tradit Chinese Med, Shanghai Key Lab Compound Chinese Med, Shanghai 201203, Peoples R China",Shanghai University,Shanghai University of Traditional Chinese Medicine,rule_match_disagree,0.75
"School of Pharmacy, Shanghai University of Traditional Chinese Medicine, Shanghai, 201210, China",Shanghai University,Shanghai University of Traditional Chinese Medicine,rule_match_disagree,1.0
"The First Affiliated Hospital of Guangzhou University of Chinese Medicine, Guangzhou, China",First Affiliated Hospital of Guangzhou University of Chinese Medicine,Guangzhou University of Chinese Medicine,rule_match_disagree,1.0
"Shanghai Univ Tradit Chinese Med, LongHua Hosp, Dept Emergency, Shanghai 200032, Peoples R China",Shanghai University,Shanghai University of Traditional Chinese Medicine,rule_match_disagree,0.75
"School of Basic Medical Science, Shanghai University of Traditional Chinese Medicine, Shanghai, 201203, China",Shanghai University,Shanghai University of Traditional Chinese Medicine,rule_match_disagree,1.0
"Western Univ Hlth Sci, Coll Pharm, Ctr Adv Drug Res & Evaluat, Pomona, CA USA",Israel Cancer Association USA,(unmatched),catch_all_no_rule,0.92
"Department of Pharmacognosy, School of Pharmacy, Second Military Medical University, Shanghai, 200433, China",Second Military Medical University,Naval Medical University,rule_match_disagree,1.0
"School of Pharmacy, Hunan University of Chinese Medicine, Changsha, 410208, China",Changchun University of Chinese Medicine,Hunan University of Chinese Medicine,rule_match_disagree,0.9
"Univ Calif San Diego, San Diego, CA 92103 USA",Israel Cancer Association USA,(unmatched),catch_all_no_rule,0.92
"Laboratory of Clinical Pharmacokinetics, Shuguang Hospital Affiliated to Shanghai University of Traditional Chinese Medicine, Shanghai, China",Second Affiliated Hospital of Hunan University of Traditional Chinese Medicine,Shanghai University of Traditional Chinese Medicine,rule_match_disagree,0.83
"Clark & Associates Stat Consulting, Nolensville, TN USA",Israel Cancer Association USA,(unmatched),catch_all_no_rule,0.62
"Amer Bot Council, Austin, TX USA",Israel Cancer Association USA,(unmatched),catch_all_no_rule,0.62
"Hlth & Environm Sci Inst, Washington, DC 20005 USA",Israel Cancer Association USA,(unmatched),catch_all_no_rule,0.77
"Department of Pharmacy, Changzheng Hospital, Second Military Medical University, Shanghai, 200003, China",Second Military Medical University,Naval Medical University,rule_match_disagree,1.0
"Second Mil Med Univ, Sch Pharm, Dept Nat Med Chem, Shanghai 200433, Peoples R China",Shanghai University,Naval Medical University,rule_match_disagree,0.75
"Shanghai Univ Tradit Chinese Med, Inst Liver Dis, Shuguang Hosp, Shanghai 201203, Peoples R China",Shanghai University,Shanghai University of Traditional Chinese Medicine,rule_match_disagree,1.0
"Jilin Ginseng Academy, Changchun University of Chinese Medicine, Changchun, 130117, China",Changchun University,Changchun University of Chinese Medicine,rule_match_disagree,1.0
"Natl Inst Environm Hlth Sci, Res Triangle Pk, NC USA",Israel Cancer Association USA,(unmatched),catch_all_no_rule,0.77
"Morehouse Sch Med, Dept Pharmacol & Toxicol, Atlanta, GA 30310 USA",Israel Cancer Association USA,(unmatched),catch_all_no_rule,0.77
"Shanghai Univ Tradit Chinese Med, Dept Pharmacol, Shanghai 201203, Peoples R China",Shanghai University,Shanghai University of Traditional Chinese Medicine,rule_match_disagree,0.75
"Western Univ Hlth Sci, Ctr Adv Drug Res & Evaluat, Coll Pharm, Pomona, CA 91766 USA",Israel Cancer Association USA,(unmatched),catch_all_no_rule,0.92
"Shanghai Univ Tradit Chinese Med, Longhua Hosp, Shanghai 200032, Peoples R China",Shanghai University,Shanghai University of Traditional Chinese Medicine,rule_match_disagree,0.75
"Shanghai Univ Tradit Chinese Med, Shuguang Hosp, Dept Med Oncol, Shanghai 201203, Peoples R China",Shuguang Hospital,Shanghai University of Traditional Chinese Medicine,rule_match_disagree,0.87
"Department of Traditional Chinese Medicine, Shuguang Hospital Affiliated to Shanghai University of Traditional Chinese Medicine, Shanghai, 201203, China",Second Affiliated Hospital of Hunan University of Traditional Chinese Medicine,Shanghai University of Traditional Chinese Medicine,rule_match_disagree,0.83
Dongzhimen Hospital Affiliated to Beijing University of Chinese Medicine,Dongzhimen Hospital Affiliated to Beijing University of Chinese Medicine,Beijing University of Chinese Medicine,rule_match_disagree,1.0
"The First Clinical College, Zhejiang Chinese Medical University, Hangzhou, China",Affiliated Hospital of Liaoning University of Traditional Chinese Medicine,Zhejiang Chinese Medical University,rule_match_disagree,1.0
"Department of Pharmacognosy, School of Pharmacy, Second Military Medical University, Shanghai, China",Second Military Medical University,Naval Medical University,rule_match_disagree,1.0
"School of Integrated Chinese and Western Medicine, Hunan University of Chinese Medicine, Changsha, 410208, China",Hebei University of Chinese Medicine,Hunan University of Chinese Medicine,rule_match_disagree,0.89
Longhua Hospital Shanghai University of Traditional Chinese Medicine,Longhua Hospital Shanghai University of Traditional Chinese Medicine,Shanghai University of Traditional Chinese Medicine,rule_match_disagree,1.0
"First Affiliated Hospital of Guangzhou University of Chinese Medicine, Guangzhou, China",First Affiliated Hospital of Guangzhou University of Chinese Medicine,Guangzhou University of Chinese Medicine,rule_match_disagree,1.0
"Shanghai TCM-Integrated Hospital, Shanghai University of Traditional Chinese Medicine, Shanghai, China",Shanghai University,Shanghai University of Traditional Chinese Medicine,rule_match_disagree,1.0
"Guangzhou Univ Chinese Med, Guangdong Prov Hosp, TCM, Guangzhou 510120, Guangdong, Peoples R China",Tianjin Conservatory of Music,Guangzhou University of Chinese Medicine,rule_match_disagree,1.0
"Medical Guarantee Center, Second Affiliated Hospital of Naval Medical University, Shanghai, China",Second Affiliated Hospital of Anhui Medical University,Naval Medical University,rule_match_disagree,0.93
"Department of Emergency and Critical Care, Second Affiliated Hospital of Naval Medical University, Shanghai, China",Second Affiliated Hospital of Anhui Medical University,Naval Medical University,rule_match_disagree,0.93
"Institute of Organ Transplantation, Second Affiliated Hospital of Naval Medical University, Shanghai, China",Second Affiliated Hospital of Anhui Medical University,Naval Medical University,rule_match_disagree,0.93
"Shanghai Univ Tradit Chinese Med, Inst Tradit Chinese Med, Shanghai 201203, Peoples R China",Shanghai University,Shanghai University of Traditional Chinese Medicine,rule_match_disagree,1.0
"Shanghai Hutchison Pharmaceuticals Company, Shanghai 200331, China",Shanghai University,(unmatched),catch_all_no_rule,0.75
"School of Pharmacy, Second Military Medical University, Shanghai, 200433, No. 325 Guohe Road, China",Second Military Medical University,Naval Medical University,rule_match_disagree,1.0
"Second Mil Med Univ, Dept Pharm, Eastern Hepatobiliary Surg Hosp, Shanghai 200438, Peoples R China",Eastern Hepatobiliary Surgery Hospital,Naval Medical University,rule_match_disagree,0.9
"Second Mil Med Univ, Dept Pharmaceut Anal, Sch Pharm, Shanghai 200433, Peoples R China",Shanghai University,Naval Medical University,rule_match_disagree,0.75
"Department of Pharmacy, Changhai Hospital, Second Military Medical University, Shanghai, China",Changhai Hospital,Naval Medical University,rule_match_disagree,1.0
"Department of Gynaecology, Shanghai Shuguang Hospital Affiliated with Shanghai University of Traditional Chinese Medicine, 528 Zhang Heng Road, Zhangjiang Hi-Tech Park, Shanghai, 201203, China",Shanghai University,Shanghai University of Traditional Chinese Medicine,rule_match_disagree,1.0
"UIC Coll Pharm, Dept Med Chem & Pharmacognosy, MC 781, Chicago, IL USA",Israel Cancer Association USA,(unmatched),catch_all_no_rule,0.77
"Department of Cardiology, Affiliated Hospital of Liaoning University of Traditional Chinese Medicine, Shenyang, China",Affiliated Hospital of Liaoning University of Traditional Chinese Medicine,Liaoning University of Traditional Chinese Medicine,rule_match_disagree,1.0
"Key Laboratory of Clinical Pharmacokinetic of TCM, Affiliated Hospital of Liaoning University of Traditional Chinese Medicine, Shenyang, China",Affiliated Hospital of Liaoning University of Traditional Chinese Medicine,Liaoning University of Traditional Chinese Medicine,rule_match_disagree,1.0
"Department of Pharmacology, Shanghai University of Traditional Chinese Medicine, Shanghai, China",Shanghai University,Shanghai University of Traditional Chinese Medicine,rule_match_disagree,1.0
"Department of Clinical Pharmacology, Affiliated Hospital of Nanjing University of Chinese Medicine, Nanjing, China",Nanjing University,Nanjing University of Chinese Medicine,rule_match_disagree,1.0
"TCM Research Institution, the Third Affiliated Hospital of Nanjing University of Chinese Medicine, Nanjing, China",Nanjing University,Nanjing University of Chinese Medicine,rule_match_disagree,1.0
"Department of Pharmaceutical Analysis, School of Pharmacy, Second Military Medical University, Shanghai, China",Second Military Medical University,Naval Medical University,rule_match_disagree,1.0
"Department of Osteopathy and Traumatology, The First Affiliated Hospital of Zhejiang Chinese Medical University, Hangzhou, China",First Affiliated Hospital Zhejiang University,Zhejiang Chinese Medical University,rule_match_disagree,0.84
"Department of Cardiology, Shuguang Hospital Affiliated to Shanghai University of Traditional Chinese Medicine, Shanghai, China",Second Affiliated Hospital of Hunan University of Traditional Chinese Medicine,Shanghai University of Traditional Chinese Medicine,rule_match_disagree,0.83
"Shanghai Institute of Materia Medica, Shanghai Institutes for Biological Sciences, Chinese Academy of Sciences, Shanghai 201203, 555 Zuchongzhi Road, China",Shanghai Institutes for Biological Sciences,Shanghai Institute of Materia Medica,rule_match_disagree,1.0
"Graduate School, Hunan University of Chinese Medicine, Hunan, Changsha, China",Hunan University,Hunan University of Chinese Medicine,rule_match_disagree,1.0
"Department of Pharmacy, Changhai Hospital, Second Military Medical University, Shanghai 200433, Changhai Road 174, China",Changhai Hospital,Naval Medical University,rule_match_disagree,1.0
"E-Institute of Shanghai Municipal Education Committee, Shanghai University of Traditional Chinese Medicine, Shanghai, China",Shanghai University,Shanghai University of Traditional Chinese Medicine,rule_match_disagree,1.0
"Shanghai Innovation Center of TCM Health Service, Shanghai University of Traditional Chinese Medicine, Shanghai, China",Shanghai University,Shanghai University of Traditional Chinese Medicine,rule_match_disagree,1.0
"School of Pharmacy, Second Military Medical University, Shanghai 200433, No. 325 Guohe Road, China",Second Military Medical University,Naval Medical University,rule_match_disagree,1.0
"Shanghai Univ Tradit Chinese Med, Sch Pharm, 1200 Cai lun Rd, Shanghai 201203, Peoples R China",Shanghai University,Shanghai University of Traditional Chinese Medicine,rule_match_disagree,0.75
"Shanghai Univ Tradit Chinese Med, Expt Ctr Sci & Technol, Shanghai, Peoples R China",Shanghai University,Shanghai University of Traditional Chinese Medicine,rule_match_disagree,0.67
"Kanion Research Institute, Shanghai University of Traditional Chinese Medicine, Shanghai, China",Shanghai University,Shanghai University of Traditional Chinese Medicine,rule_match_disagree,1.0
"2nd Affiliated Hospital of Liaoning University of Traditional Chinese Medicine, Shenyang, China",Affiliated Hospital of Liaoning University of Traditional Chinese Medicine,Liaoning University of Traditional Chinese Medicine,rule_match_disagree,1.0
"School of Pharmacy, The Second Military Medical University, Shanghai, China",Second Military Medical University,Naval Medical University,rule_match_disagree,1.0
"Department of Traditional Chinese Medicine, Nanjing Drum Tower Hospital Clinical College of Nanjing University of Chinese Medicine, Nanjing, China",Nanjing Drum Tower Hospital,Nanjing University of Chinese Medicine,rule_match_disagree,1.0
"Department of Pharmacy, Changzheng Hospital, Naval Medical University (Second Military Medical University), Shanghai, China",Shanghai Changzheng Hospital,Naval Medical University,rule_match_disagree,0.82
"Shanghai Key Laboratory for Pharmaceutical Metabolite Research, Naval Medical University (Second Military Medica University), Shanghai, China",Xinqiao Hospital,Naval Medical University,rule_match_disagree,0.71
"Scientific Technology Experiment Center, Shanghai University of Traditional Chinese Medicine, Shanghai 201203, China",Shanghai University,Shanghai University of Traditional Chinese Medicine,rule_match_disagree,1.0
"Shanghai Univ Tradit Chinese Med, Key Lab Standardizat Chinese Med, Minist Educ, Inst Chinese Mat Med, Shanghai 201210, Peoples R China",Shanghai University,Shanghai University of Traditional Chinese Medicine,rule_match_disagree,0.75
"Shanghai R&D Ctr Standardizat Chinese Med, Shanghai 201210, Peoples R China",Shanghai University,(unmatched),catch_all_no_rule,0.75
"SATCM Key Lab New Resources & Qual Evaluat Chines, Shanghai 201210, Peoples R China",Shanghai University,(unmatched),catch_all_no_rule,0.75
"First Teaching Hospital of Tianjin University of Traditional Chinese Medicine, NO. 88 Changling Road, Xiqing District, Tianjin, 300381, China",First Teaching Hospital of Tianjin University of Traditional Chinese Medicine,Tianjin University of Traditional Chinese Medicine,rule_match_disagree,1.0
"Shanghai Univ Tradit Chinese Med, Shuguang Hosp, Clin Pharmacokinet Lab, 528 Zhangheng Rd, Shanghai 201203, Peoples R China",Shuguang Hospital,Shanghai University of Traditional Chinese Medicine,rule_match_disagree,0.87
"Shanghai Univ Tradit Chinese Med, Shuguang Hosp, Dept Med Oncol, Shanghai 200062, Peoples R China",Shuguang Hospital,Shanghai University of Traditional Chinese Medicine,rule_match_disagree,0.87
"Shanghai Univ Tradit Chinese Med, Shanghai Shuguang Hosp, Cardiovasc Dept, Shanghai 201203, Peoples R China",Shanghai University,Shanghai University of Traditional Chinese Medicine,rule_match_disagree,0.75
"The Second Affiliated Hospital of Nanjing University of Chinese Medicine, Nanjing, 210017, China",Nanjing University,Nanjing University of Chinese Medicine,rule_match_disagree,1.0
"Department of Neurology, Affiliated Hospital of Shandong University of Traditional Chinese Medicine, Jinan, China",Affiliated Hospital of Shandong University of Traditional Chinese Medicine,Shandong University of Traditional Chinese Medicine,rule_match_disagree,1.0
"Shuguang Hospital, Affiliated to Shanghai University, Traditional Chinese Medicine, Shanghai 200021, China",Shanghai University,(unmatched),catch_all_no_rule,1.0
"Engineering Research Center of Modern Preparation Technology of TCM, Ministry of Education, Shanghai University, Shanghai 201203, No.1200 Cailun Road, China",Shanghai University,(unmatched),catch_all_no_rule,1.0
"College of Chinese Material Medica, Shanghai University, Traditional Chinese Medicine, Shanghai 201203, China",Shanghai University,(unmatched),catch_all_no_rule,1.0
"Department of Pharmacology, Shanghai University of Traditional Chinese Medicine, 1200 Cai Lun Road, Shanghai, 201203, China",Shanghai University,Shanghai University of Traditional Chinese Medicine,rule_match_disagree,1.0
"Second Mil Med Univ, Sch Pharm, Dept Pharm, Eastern Hepatobiliary Surg Hosp, Shanghai 200438, Peoples R China",Eastern Hepatobiliary Surgery Hospital,Naval Medical University,rule_match_disagree,0.9
"Second Mil Med Univ, Sch Pharm, Dept Pharmaceut Anal, Shanghai 200433, Peoples R China",Shanghai University,Naval Medical University,rule_match_disagree,0.75
