raw_string,old_ror_name,new_ror_name,reason,chosen_score
"Western Univ Hlth Sci, Coll Vet, Pomona, CA USA",Israel Cancer Association USA,(unmatched),catch_all_no_rule,0.92
"Western Univ Hlth Sci, Coll Pharm, Dept Pharmaceut Sci, Pomona, CA 91766 USA",Israel Cancer Association USA,(unmatched),catch_all_no_rule,0.92
"Shanghai Univ Tradit Chinese Med, Intervent Canc Inst Chinese Integrat Med, Putuo Hosp, Shanghai 200062, Peoples R China",Shanghai University,Shanghai University of Traditional Chinese Medicine,rule_match_disagree,1.0
"Shanghai Univ Tradit Chinese Med, Putuo Hosp, Dept Gen Surg, Shanghai 200062, Peoples R China",Shanghai University,Shanghai University of Traditional Chinese Medicine,rule_match_disagree,0.75
Shanghai University,Shanghai University,(unmatched),catch_all_no_rule,1.0
"Key Laboratory of Acupuncture and Immunological Effects, Yueyang Hospital of Integrated Traditional Chinese and Western Medicine Affiliated to Shanghai University of Traditional Chinese Medicine, Shan",Hunan Provincial Hospital of Integrated Traditional Chinese and Western Medicine (The Affiliated Hospital of Hunan Academy of Traditional Chinese Medicine),Shanghai University of Traditional Chinese Medicine,rule_match_disagree,0.84
"Department of Acupuncture and Moxibustion, Shanghai TCM-Integrated Hospital, Shanghai University of Traditional Chinese Medicine, Shanghai, 200082, China",Shanghai University,Shanghai University of Traditional Chinese Medicine,rule_match_disagree,1.0
"Department of Pharmacy, Affiliated Hospital of Nanjing University of Chinese Medicine, Nanjing, 210029, China",Nanjing University,Nanjing University of Chinese Medicine,rule_match_disagree,1.0
"Chinese Acad Sci, Grad Sch, Shanghai 200031, Peoples R China",Shanghai University,(unmatched),catch_all_no_rule,0.75
"Department of Dermatology, Wuhan No.1 Hospital, Hospital of Traditional Chinese and Western Medicine Affiliated to Hubei University of Chinese Medicine, Wuhan Hospital of Traditional Chinese and Weste",Wuhan No.1 Hospital,Hubei University of Chinese Medicine,rule_match_disagree,1.0
"Department of Dermatology, Hubei Provincial Hospital of Traditional Chinese Medicine, Hospital Affiliated to Hubei University of Chinese Medicine, Wuhan, China",Hubei Provincial Hospital of Traditional Chinese Medicine,Hubei University of Chinese Medicine,rule_match_disagree,1.0
"Experiment Center for Teaching and Learning, Shanghai University of Traditional Chinese Medicine, Pudong New District, Shanghai, China",Shanghai University,Shanghai University of Traditional Chinese Medicine,rule_match_disagree,1.0
"Foreign Languages Teaching Center, Shanghai University of Traditional Chinese Medicine, Pudong New District, Shanghai, China",Shanghai University,Shanghai University of Traditional Chinese Medicine,rule_match_disagree,1.0
"Hunan Academy of Chinese Medicine, Hunan University of Chinese Medicine, Changsha, 410013, Hunan, China",Hunan University,Hunan University of Chinese Medicine,rule_match_disagree,1.0
"Hunan Academy of Chinese Medicine, Hunan University of Chinese Medicine, Hunan, Changsha, 410013, China",Hunan University,Hunan University of Chinese Medicine,rule_match_disagree,1.0
"Department of TCM Processing, Shanghai University of Traditional Chinese Medicine, Shanghai, China",Shanghai University,Shanghai University of Traditional Chinese Medicine,rule_match_disagree,1.0
"Department of Pharmacy, Changzheng Hospital, Second Military Medical University, Shanghai, China",Second Military Medical University,Naval Medical University,rule_match_disagree,1.0
"Department of Medical Oncology, The First Affiliated Hospital of Zhejiang Chinese Medical University (Zhejiang Provincial Hospital of Chinese Medicine), Zhejiang, Hangzhou, China",The Third Affiliated Hospital of Zhejiang Chinese Medical University,Zhejiang Chinese Medical University,rule_match_disagree,0.95
"The First Affiliated Hospital of Zhejiang Chinese Medical University (Zhejiang Provincial Hospital of Chinese Medicine), Zhejiang, Hangzhou, 310006, China",The Third Affiliated Hospital of Zhejiang Chinese Medical University,Zhejiang Chinese Medical University,rule_match_disagree,0.95
"Department of Nephrology, Shuguang Hospital Affiliated to Shanghai University of Traditional Chinese Medicine, No. 528 Zhangheng Road, Pudong District, Shanghai, 201203, China",Second Affiliated Hospital of Hunan University of Traditional Chinese Medicine,Shanghai University of Traditional Chinese Medicine,rule_match_disagree,0.83
"Department of Pharmacology, Shanghai University of Traditional Chinese Medicine, Shanghai, 201203, China",Shanghai University,Shanghai University of Traditional Chinese Medicine,rule_match_disagree,1.0
"Shanghai Univ Tradit Chinese Med, Dept Pulm Dis, Shanghai 200072, Peoples R China",Shanghai University,Shanghai University of Traditional Chinese Medicine,rule_match_disagree,0.75
"Jingan Dist Hosp Tradit Chinese Med, Shanghai Med Coll, Dept Pulm Dis, Shanghai 200072, Peoples R China",Shanghai University,(unmatched),catch_all_no_rule,0.75
"TCM and Ethnomedicine Innovation & Development International Laboratory, Innovative Materia Medica Research Institute, Medica Research Institute, Hunan University of Chinese Medicine, Hunan, Changsha,",Hebei University of Chinese Medicine,Hunan University of Chinese Medicine,rule_match_disagree,0.89
"College of Pharmacy, Affiliated Hospital to Changchun University of Chinese Medicine, Changchun, 130021, China",Changchun University,Changchun University of Chinese Medicine,rule_match_disagree,1.0
"Naval Med Univ, Sch Pharm, Shanghai, Peoples R China",People’s Hospital of Rizhao,Naval Medical University,rule_match_disagree,0.57
"Integrated Traditional Chinese and Western Medicine Hospital, Affiliated to Shanghai University of Traditional Chinese Medicine, Shanghai, 201203, China",Beijing Chang'an Integrated Traditional Chinese and Western Medicine Hospital,Shanghai University of Traditional Chinese Medicine,rule_match_disagree,0.88
"Bristol Myers Squibb Co, Dept Drug Metab & Pharmacokinet, Princeton, NJ USA",Israel Cancer Association USA,(unmatched),catch_all_no_rule,0.62
"Chinese Acad Sci, Shanghai Inst Mat Med, Lab DMPK Res Herbal Med, Shanghai 201203, Peoples R China",Shanghai University,Shanghai Institute of Materia Medica,rule_match_disagree,0.75
"Worldwide R&D Pfizer Inc, Pharmacokinet Dynam & Metab, Groton, CT USA",Israel Cancer Association USA,(unmatched),catch_all_no_rule,0.77
"MassDefect Technol, Princeton, NJ 08540 USA",Israel Cancer Association USA,(unmatched),catch_all_no_rule,0.62
"State Key Laboratory of Dampness Syndrome of Chinese Medicine, Guangdong Provincial, Hospital of Chinese Medicine, Guangdong, Provincial Academy of Chinese Medical Sciences, the Second Affiliated Hosp",Second Affiliated Hospital of Zhengzhou University,Guangzhou University of Chinese Medicine,rule_match_disagree,0.94
"Department of Medicinal Chemistry, School of Pharmacy, Hunan University of Chinese Medicine, Changsha, 410208, China",Changchun University of Chinese Medicine,Hunan University of Chinese Medicine,rule_match_disagree,0.9
"Sanford Burnham Med Res Inst, Ctr Canc, La Jolla, CA USA",Israel Cancer Association USA,(unmatched),catch_all_no_rule,0.92
"Shanghai Univ Tradit Chinese Med, Res Ctr Tradit Chinese Med Complex Syst, Shanghai, Peoples R China",Shanghai University,Shanghai University of Traditional Chinese Medicine,rule_match_disagree,0.67
"Guangzhou Univ Chinese Med, Int Inst Translat Chinese Med, Guangzhou 51006, Guangdong, Peoples R China",Guangzhou University,Guangzhou University of Chinese Medicine,rule_match_disagree,1.0
"Affiliated Changzheng Hospital, Second Military Medical University, Shanghai, 200003, China",Second Military Medical University,Naval Medical University,rule_match_disagree,1.0
"Faculty of Naval Medicine, Second Military Medical University, Shanghai, 200433, China",Second Military Medical University,Naval Medical University,rule_match_disagree,1.0
"Western Univ Hlth Sci, Coll Pharm, Dept Pharmaceut Sci, Pomona, CA USA",Israel Cancer Association USA,(unmatched),catch_all_no_rule,0.92
"Western Univ Hlth Sci, Coll Pharm, Dept Pharm Practice & Adm, Pomona, CA 91766 USA",Israel Cancer Association USA,(unmatched),catch_all_no_rule,0.92
"Western Univ Hlth Sci, Coll Pharm, Dept Pharm Practice & Adm, Pomona, CA USA",Israel Cancer Association USA,(unmatched),catch_all_no_rule,0.92
"Orthopaedic Microsurgery, Affiliated Hospital of Shandong University of Traditional Chinese Medicine, Shandong, China",Shandong University,Shandong University of Traditional Chinese Medicine,rule_match_disagree,1.0
"Chinese Acad Sci, Shanghai Inst Mat Med, Shanghai Res Ctr Modernizat Tradit Chinese Med, Shanghai 200031, Peoples R China",Shanghai University,Shanghai Institute of Materia Medica,rule_match_disagree,0.75
"Department of Clinical Pharmacology, Shuguang Hospital Affiliated to Shanghai University of TCM, Shanghai, 201203, No. 528 Zhangheng Road, Pudong New Area, China",Shanghai University,(unmatched),catch_all_no_rule,1.0
"Shanghai Univ Tradit Chinese Med, Sch Pharm, Dept Pharmacol, 1200 Cai Lun Rd, Shanghai 201203, Peoples R China",Shanghai University,Shanghai University of Traditional Chinese Medicine,rule_match_disagree,0.75
"Science and Technology Center, Shanghai University of Traditional Chinese Medicine, Shanghai 201203, China",Shanghai University,Shanghai University of Traditional Chinese Medicine,rule_match_disagree,1.0
"Shanghai Univ Tradit Chinese Med, Shanghai Shuguang Hosp, Dept Gynaecol, Shanghai 201203, Peoples R China",Shanghai University,Shanghai University of Traditional Chinese Medicine,rule_match_disagree,0.75
"Shanghai Univ Tradit Chinese Med, Inst Tradit Chinese Med, SATCM Key Lab New Resources & Qual Evaluat Chines, Key Lab Standardizat Chinese Med,Minist Educ MOE, Shanghai 201203, Peoples R China",Shanghai University,Shanghai University of Traditional Chinese Medicine,rule_match_disagree,0.75
"Department of Paediatrics, Changhai Hospital, Second Military Medical University, Shanghai, China",Changhai Hospital,Naval Medical University,rule_match_disagree,1.0
"Department of Anesthesiology, Second Affiliated Hospital of Shandong University of Traditional Chinese Medicine, Shandong, 250014, China",Shandong University,Shandong University of Traditional Chinese Medicine,rule_match_disagree,1.0
"The First Affiliated Hospital of Zhejiang Chinese Medical University (Zhejiang Provincial Hospital of Chinese Medicine), Zhejiang, Hangzhou, China",The Third Affiliated Hospital of Zhejiang Chinese Medical University,Zhejiang Chinese Medical University,rule_match_disagree,0.95
"Fangzheng Research Laboratory, Jilin Ginseng Academy, Changchun University of Chinese Medicine, Changchun, China",Changchun University,Changchun University of Chinese Medicine,rule_match_disagree,1.0
"Department of Gastroenterology, The First Affiliated Hospital of Zhejiang Chinese Medical University, Hangzhou, China",First Affiliated Hospital Zhejiang University,Zhejiang Chinese Medical University,rule_match_disagree,0.84
"Department of Gastroenterology, The First Affiliated Hospital of Zhejiang Chinese Medical University, Zhejiang, Hangzhou, China",The Third Affiliated Hospital of Zhejiang Chinese Medical University,Zhejiang Chinese Medical University,rule_match_disagree,0.95
"Shanghai Univ Tradit Chinese Med, Sch Pharm, Dept Pharmacol, Shanghai, Peoples R China",Shanghai University,Shanghai University of Traditional Chinese Medicine,rule_match_disagree,0.67
"Shanghai Univ Tradit Chinese Med, Inst Liver Dis, Shuguana Hosp, Key Lab Liver & Kidney Dis,Minist Educ, Shanghai, Peoples R China",Shanghai University,Shanghai University of Traditional Chinese Medicine,rule_match_disagree,1.0
"Shanghai Univ Tradit Chinese Med, Shanghai Key Lab Compound Chinese Med, Shanghai, Peoples R China",Shanghai University,Shanghai University of Traditional Chinese Medicine,rule_match_disagree,0.67
"Hunan Univ Chinese Med, Prov Key Lab Tradit Chinese Med Diagnost, Changsha, Hunan, Peoples R China",Hunan University of Traditional Chinese Medicine,Hunan University of Chinese Medicine,rule_match_disagree,0.74
"School of Medicine, Hunan University of Chinese Medicine, Changsha, China",Hebei University of Chinese Medicine,Hunan University of Chinese Medicine,rule_match_disagree,0.89
"Galactophore Department, The First Hospital of Hunan University of Chinese Medicine, Changsha, China",First Affiliated Hospital of Guangzhou University of Chinese Medicine,Hunan University of Chinese Medicine,rule_match_disagree,0.87
"Central Laboratory, Affiliated Hospital of Nanjing University of Chinese Medicine, Nanjing, China",Nanjing University,Nanjing University of Chinese Medicine,rule_match_disagree,1.0
"Shanghai Univ, Affiliated Hosp 3, Wenzhou Peoples Hosp, Wenzhou, Peoples R China",Shanghai University,(unmatched),catch_all_no_rule,1.0
"School of Pharmacy, Shanghai University of Tranditional Chinese Medicine, Shanghai, China",Shanghai University,(unmatched),catch_all_no_rule,1.0
"Shanghai Univ Tradit Chinese Med, Shanghai Res Inst Acupuncture & Meridian, Shanghai, Peoples R China",Shanghai University,Shanghai University of Traditional Chinese Medicine,rule_match_disagree,1.0
"Shanghai Univ Tradit Chinese Med, Inst Interdisciplinary Integrat Med Res, Shanghai Frontiers Sci Ctr Chinese Med Chem Biol, Shangha, Peoples R China",Shanghai Traditional Chinese Medicine Hospital,Shanghai University of Traditional Chinese Medicine,rule_match_disagree,0.7
"Department of Pharmacy, Changzheng Hospital, Navl Medical University (Second Military Medical University), Shanghai, China",Shanghai Changzheng Hospital,Naval Medical University,rule_match_disagree,0.82
"Chinese Acad Sci, Shanghai Inst Mat Med, Nat Prod Chem Dept, Shanghai, Peoples R China",People’s Hospital of Rizhao,Shanghai Institute of Materia Medica,rule_match_disagree,0.57
"Chinese Acad Sci, Shanghai Inst Mat Med, Natl Engn Lab TCM Standardizat Technol, Shanghai, Peoples R China",People’s Hospital of Rizhao,Shanghai Institute of Materia Medica,rule_match_disagree,0.57
"Shanghai Univ Tradit Chinese Med, Cent Hosp Shanghai Putuo Dist, Dept Cardiol, Shanghai, Peoples R China",Shanghai Chest Hospital,Shanghai University of Traditional Chinese Medicine,rule_match_disagree,0.73
"Shanghai Univ Tradit Chinese Med, Yueyang Hosp Integrated Tradit Chinese & Western M, Dept Neurol, Shanghai, Peoples R China",First People's Hospital of Chongqing,Shanghai University of Traditional Chinese Medicine,rule_match_disagree,0.71
"Shanghai Univ Tradit Chinese Med, Inst Interdisciplinary Integrat Med Res, Shanghai Frontiers Sci Ctr TCM Chem Biol, Shanghai, Peoples R China",Shanghai University,Shanghai University of Traditional Chinese Medicine,rule_match_disagree,1.0
"Shanghai Univ Tradit Chinese Med, Shuguang Hosp, Inst Liver Dis, Minist Educ,Key Lab Liver & Kidney Dis,Shanghai Ke, Shanghai, Peoples R China",Shanghai University,Shanghai University of Traditional Chinese Medicine,rule_match_disagree,1.0
"Hlth & Environm Sci Inst, Washington, DC USA",Israel Cancer Association USA,(unmatched),catch_all_no_rule,0.77
"CDCP, COVID 19 Response Int Task Force, Atlanta, GA 30333 USA",Israel Cancer Association USA,(unmatched),catch_all_no_rule,0.77
"Hunan Univ Chinese Med, Sch Pharm, Changsha, Hunan, Peoples R China",Hunan University of Traditional Chinese Medicine,Hunan University of Chinese Medicine,rule_match_disagree,0.74
"Hunan Univ Chinese Med, Coll Integrated Tradit Chinese Med & Western Med, Key Lab Hunan Prov Integrated Tradit Chinese & Wes, Changsha, Hunan, Peoples R China",Hunan University of Traditional Chinese Medicine,Hunan University of Chinese Medicine,rule_match_disagree,0.74
"Affiliated Hospital of Shandong University of Traditional Chinese Medicine, Jinan, China",Affiliated Hospital of Shandong University of Traditional Chinese Medicine,Shandong University of Traditional Chinese Medicine,rule_match_disagree,1.0
"Cancer Institute, Longhua Hospital, Shanghai University of Traditional Chinese Medicine, Shanghai, China",Shanghai University,Shanghai University of Traditional Chinese Medicine,rule_match_disagree,1.0
"Breast Surgery Department, Baoshan Hospital Affiliated to Shanghai University of Traditional Chinese Medicine, Shanghai, China",Second Affiliated Hospital of Hunan University of Traditional Chinese Medicine,Shanghai University of Traditional Chinese Medicine,rule_match_disagree,0.83
"Department of Intensive Care Medicine, Shuguang Hospital Affiliated to Shanghai University of Traditional Chinese Medicine, Shanghai, China",Second Affiliated Hospital of Hunan University of Traditional Chinese Medicine,Shanghai University of Traditional Chinese Medicine,rule_match_disagree,0.83
"Science and Technology Experimental Center, Shanghai University of Traditional Chinese Medicine, Shanghai, China",Shanghai University,Shanghai University of Traditional Chinese Medicine,rule_match_disagree,1.0
"Hunan Univ Chinese Med, Key Lab Hunan Prov Integrated Tradit Chinese & Wes, Changsha, Peoples R China",Hunan University of Traditional Chinese Medicine,Hunan University of Chinese Medicine,rule_match_disagree,0.74
"Amyris Inc, Emeryville, CA 94608 USA",Israel Cancer Association USA,(unmatched),catch_all_no_rule,0.92
"Key Laboratory of Oncology of Traditional Chinese Medicine, Hunan University of Chinese Medicine, Changsha, 410012, China",Hebei University of Chinese Medicine,Hunan University of Chinese Medicine,rule_match_disagree,0.89
"Hunan Key Laboratory of Traditional Chinese Medicine Prescription and Syndromes Translational Medicine, Hunan University of Chinese Medicine, Changsha, 410208, China",Hebei University of Chinese Medicine,Hunan University of Chinese Medicine,rule_match_disagree,0.89
"Key Laboratory of Traditional Chinese Medicine for Mechanism of Tumor Prevention and Treatment, Hunan University of Chinese Medicine, Changsha, 410208, China",Hebei University of Chinese Medicine,Hunan University of Chinese Medicine,rule_match_disagree,0.89
"Department of Galactophore, The First Hospital of Hunan University of Chinese Medicine, Changsha, 410007, China",First Affiliated Hospital of Guangzhou University of Chinese Medicine,Hunan University of Chinese Medicine,rule_match_disagree,0.87
"Coll Med Ctr, Psychiat, Long Beach, CA 90806 USA",Israel Cancer Association USA,(unmatched),catch_all_no_rule,0.92
"Calif Univ Sci & Med, Sch Med, Colton, CA 92324 USA",Israel Cancer Association USA,(unmatched),catch_all_no_rule,0.92
"Shanghai Ctr Bioinformat Technol, Shanghai 200235, Peoples R China",Shanghai University,(unmatched),catch_all_no_rule,0.75
"Viecare Butler, Program All Inclus Care Elderly Pace, Butler, PA 16001 USA",Israel Cancer Association USA,(unmatched),catch_all_no_rule,0.77
"Second Mil Med Univ, Changzheng Hosp, Dept Pharm, Shanghai 200433, Peoples R China",Shanghai University,Naval Medical University,rule_match_disagree,0.75
"Guangzhou Univ Chinese Med, Inst Clin Pharmacol, 12 Jichang Rd, Guangzhou 510405, Guangdong, Peoples R China",Guangzhou University,Guangzhou University of Chinese Medicine,rule_match_disagree,1.0
"Univ Chinese Acad Sci, Coll Life Sci, Beijing 100049, Peoples R China",Changchun University of Chinese Medicine,University of Chinese Academy of Sciences,rule_match_disagree,0.72
"Shanghai Univ Tradit Chinese Med, Dept Chinese Mat Med, Shanghai 201203, Peoples R China",Shanghai University,Shanghai University of Traditional Chinese Medicine,rule_match_disagree,0.75
"Shanghai Univ Tradit Chinese Med, Engn Res Ctr Modern Preparat Technol TCM Minist E, Shanghai 201203, Peoples R China",Shanghai University,Shanghai University of Traditional Chinese Medicine,rule_match_disagree,0.75
"Shandong Univ Tradit Chinese Med, Pharmaceut Res Inst, Jinan 250355, Peoples R China",Shandong University,Shandong University of Traditional Chinese Medicine,rule_match_disagree,1.0
"Univ Calif San Diego, Dept Bioengn, La Jolla, CA 92093 USA",Israel Cancer Association USA,(unmatched),catch_all_no_rule,0.92
"Univ Calif San Diego, Skaggs Sch Pharm & Pharmaceut Sci, La Jolla, CA 92093 USA",Israel Cancer Association USA,(unmatched),catch_all_no_rule,0.92
"Univ Calif San Diego, Dept Biol, La Jolla, CA 92093 USA",Israel Cancer Association USA,(unmatched),catch_all_no_rule,0.92
"Univ Calif San Diego, Sch Med, Dept Pharmacol, La Jolla, CA 92093 USA",Israel Cancer Association USA,(unmatched),catch_all_no_rule,0.92
"Univ Calif San Diego, Dept Pediat, La Jolla, CA 92093 USA",Israel Cancer Association USA,(unmatched),catch_all_no_rule,0.92
"Univ Calif San Diego, Dept Med Nephrol, La Jolla, CA 92093 USA",Israel Cancer Association USA,(unmatched),catch_all_no_rule,0.92
"Analysis and Testing Center, School of Pharmacy, Second Military Medical University, Shanghai 200433, China",Second Military Medical University,Naval Medical University,rule_match_disagree,1.0
"Key Laboratory of Basic and Application Research of Beiyao, Heilongjiang University of Chinese Medicine, Heilongjiang Province, Harbin, 150040, China",Heilongjiang University,Heilongjiang University of Chinese Medicine,rule_match_disagree,1.0
"Hunan Univ Chinese Med, Coll Pharmaceut Sci, Changsha 410208, Hunan, Peoples R China",Hunan University of Traditional Chinese Medicine,Hunan University of Chinese Medicine,rule_match_disagree,0.74
"Zhenxin Community Hlth Serv Ctr, Dept Tradit Chinese Med, Shanghai 201824, Peoples R China",Shanghai University,(unmatched),catch_all_no_rule,0.75
"Shanghai Univ Tradit Chinese Med, Dept Urol Surg, Shuguang Hosp, 528 Zhangheng Rd, Shanghai 201203, Peoples R China",Shuguang Hospital,Shanghai University of Traditional Chinese Medicine,rule_match_disagree,0.87
"Department of Gynecology, Shuguang Hospital Affiliated with Shanghai University of T.C.M, Shanghai, 200240, China",Shanghai University,(unmatched),catch_all_no_rule,1.0
"Center for Drug Clinical Research, Shanghai University of Traditional Chinese Medicine, 1200 Cailun Road, Shanghai, 201203, China",Shanghai University,Shanghai University of Traditional Chinese Medicine,rule_match_disagree,1.0
"Chinese Acad Sci, Shanghai Inst Mat Med, Shanghai Res Ctr Modernizat Tradit Chinese Med, Shanghai 201203, Peoples R China",Shanghai University,Shanghai Institute of Materia Medica,rule_match_disagree,0.75
"Second Mil Med Univ, Dept Tradit Chinese Med, Changhai Hosp, Shanghai 200433, Peoples R China",Changhai Hospital,Naval Medical University,rule_match_disagree,0.87
"Wenzhou Med Univ, Shanghai Univ, Wenzhou Peoples Hosp, Dept Pharm,Clin Inst 3,Affiliated Hosp 3, Wenzhou 325800, Zhejiang, Peoples R China",Shanghai University,(unmatched),catch_all_no_rule,1.0
"Hunan Univ Chinese Med, Diagnost Inst Tradit Chinese Med, Dept Diag, Changsha 410208, Hunan, Peoples R China",Hunan University,Hunan University of Chinese Medicine,rule_match_disagree,1.0
"Hunan Univ Chinese Med, Dept Chem, Key Lab Modernizat Chinese Med, Changsha 410208, Hunan, Peoples R China",Hunan University of Traditional Chinese Medicine,Hunan University of Chinese Medicine,rule_match_disagree,0.74
"Hunan Univ Chinese Med, Sch Pharm, TCM & Ethnomed Innovat & Dev Lab, Changsha 410208, Hunan, Peoples R China",Hunan University of Traditional Chinese Medicine,Hunan University of Chinese Medicine,rule_match_disagree,0.74
"National TCM Key Laboratory of Serum Pharmaco-Chemistry, Heilongjiang University of Chinese Medicine, Harbin, Heilongjiang Provine, 150040, 24 Heping Road, China",Heilongjiang University,Heilongjiang University of Chinese Medicine,rule_match_disagree,1.0
"Univ Calif Irvine, Dept Clin Pharm Practice, Irvine, CA 92697 USA",Israel Cancer Association USA,(unmatched),catch_all_no_rule,0.92
"Department of Pharmacy, Changzheng Hospital, Naval Medical University, Shanghai, China",Shanghai Changzheng Hospital,Naval Medical University,rule_match_disagree,0.82
"Department of Gastroenterology, Changzheng Hospital, Naval Medical University, Shanghai, China",Shanghai Changzheng Hospital,Naval Medical University,rule_match_disagree,0.81
"Department of Nephrology, Changzheng Hospital, Naval Medical University, Shanghai, China",Shanghai Changzheng Hospital,Naval Medical University,rule_match_disagree,0.81
"Shanghai Key Laboratory for Pharmaceutical Metabolite Research, Changzheng Hospital, Naval Medical University, Shanghai, China",Shanghai Artificial Intelligence Laboratory,Naval Medical University,rule_match_disagree,0.86
"Naval Med Univ, Sch Pharm, Dept Pharmaceut Bot, Shanghai 200433, Peoples R China",Shanghai University,Naval Medical University,rule_match_disagree,0.75
"The First Affiliated Hospital of Zhejiang Chinese Medical University, Zhejiang, Hangzhou, 310006, China",The Third Affiliated Hospital of Zhejiang Chinese Medical University,Zhejiang Chinese Medical University,rule_match_disagree,0.95
"Shanghai Ginposome Pharmatech Co Ltd, Shanghai 201600, Peoples R China",Shanghai University,(unmatched),catch_all_no_rule,0.75
"Guangzhou Univ Chinese Med, Inst Trop Med, Guangzhou 510006, Guangdong, Peoples R China",Guangzhou University,Guangzhou University of Chinese Medicine,rule_match_disagree,1.0
"Minist Educ, Key Lab Smart Drug Delivery, Shanghai 201203, Peoples R China",Shanghai University,(unmatched),catch_all_no_rule,0.75
"E China Univ Sci & Technol, Sch Pharm, Shanghai Key Lab New Drug Design, Shanghai 200237, Peoples R China",Shanghai University,(unmatched),catch_all_no_rule,0.75
"Emiliem Inc, Emeryville, CA 94608 USA",Israel Cancer Association USA,(unmatched),catch_all_no_rule,0.92
"Univ Calif Berkeley, Dept Nutr Sci & Toxicol, Berkeley, CA 94720 USA",Israel Cancer Association USA,(unmatched),catch_all_no_rule,0.92
"Kaiser Permanente Med Ctr, Dept Pharm, Oakland, CA USA",Israel Cancer Association USA,(unmatched),catch_all_no_rule,0.92
"Santa Clara Valley Med Ctr, Dept Pharm, San Jose, CA 95128 USA",Israel Cancer Association USA,(unmatched),catch_all_no_rule,0.92
