doi,n_records_merged,source_dbs,chosen_db,chosen_record_id,year,title_first50
10.1186/s13020-025-01291-y,2,Scopus;WoS,WoS,WoS:WOS:001656125500001,2026,The scientific basis of synergy in traditional Chi
10.1186/s13020-026-01326-y,1,Scopus,Scopus,Scopus:2-s2.0-105027392901,2026,Supramolecular self-assembly in Traditional Chines
10.1186/s13048-025-01872-3,1,Scopus,Scopus,Scopus:2-s2.0-105031681970,2026,MAPK signaling reprogramming via integrative TCM-W
10.1186/s13148-026-02057-5,1,PubMed,PubMed,PubMed:41580768,2026,Single-cell transcriptomics uncover RNF130-mediate
10.1186/s40104-025-01348-w,4,OpenAlex;PubMed;Scopus;WoS,WoS,WoS:WOS:001702240800001,2026,Ability of the Chinese herbal residue to alleviate
10.1186/s41065-025-00620-3,1,Scopus,Scopus,Scopus:2-s2.0-105027335125,2026,Multimethodological and multiscale investigation o
10.1200/jco.2026.44.7_suppl.tps413,2,OpenAlex;Scopus,Scopus,Scopus:2-s2.0-105036360897,2026,Evaluation of the safety and efficacy of daily ora
10.1208/s12249-025-03321-2,1,Scopus,Scopus,Scopus:2-s2.0-105033211160,2026,Moisture-Proof Herbal Extract Pellets Prepared via
10.1248/bpb.b25-00787,1,Scopus,Scopus,Scopus:2-s2.0-105037729847,2026,The Dual Role of Saikosaponins in Liver Disease Tr
10.13048/jkm.26008,1,OpenAlex,OpenAlex,OpenAlex:W7133520867,2026,Safety Assessment Based on Sosiho-tang Genotoxicit
10.1371/journal.pone.0342857,2,PubMed;Scopus,Scopus,Scopus:2-s2.0-105030102115,2026,Effects of matcha green tea on the pharmacokinetic
10.14218/fim.2025.00059,1,OpenAlex,OpenAlex,OpenAlex:W7143427599,2026,Bridging Traditional Medicine with Modern Technolo
10.14218/jtg.2025.00030,1,WoS,WoS,WoS:WOS:001756141500004,2026,Herbal Approaches to Gastrointestinal Disorders: I
10.17161/kjm.vol19.25374,1,OpenAlex,OpenAlex,OpenAlex:W7155215209,2026,Complementary Medicine in Oncology: A Dual-Perspec
10.18311/ti/2026/v33i1/53508,1,Scopus,Scopus,Scopus:2-s2.0-105035771043,2026,Pharmacovigilance and Adverse Drug Reactions in Tr
10.19852/j.cnki.jtcm.2026.01.024,1,Scopus,Scopus,Scopus:2-s2.0-105029130818,2026,Molecular landscape of Berberine's therapeutic pot
10.19852/j.cnki.jtcm.2026.02.009,2,PubMed;Scopus,Scopus,Scopus:2-s2.0-105035353196,2026,Exploring the potential mechanism of Huang’e capsu
10.2147/dddt.s565281,1,Scopus,Scopus,Scopus:2-s2.0-105029686331,2026,Modified Jie-Yu-He-Huan Capsule in Post-Stroke Dep
10.2147/dddt.s570847,4,OpenAlex;PubMed;Scopus;WoS,WoS,WoS:WOS:001680796000001,2026,Integrated Western and Traditional Chinese Medicin
10.2147/dddt.s577265,1,Scopus,Scopus,Scopus:2-s2.0-105029543557,2026,Matrine in Liver Diseases: Mechanistic Insights an
10.2147/ijn.s556912,1,PubMed,PubMed,PubMed:41924451,2026,Aptamer-Mediated Dual-Loaded Liposomal Nanosystem 
10.2174/0109298673402330251125051751,2,Scopus;WoS,WoS,WoS:WOS:001701852100001,2026,Geniposide Attenuates Post-Myocardial Infarction C
10.2174/0109298673428595251209114801,4,OpenAlex;PubMed;Scopus;WoS,WoS,WoS:WOS:001702741900001,2026,Herbal Medicines and Drugs Interactions: Cytochrom
10.2174/0113862073335295241216152011,1,Scopus,Scopus,Scopus:2-s2.0-105032239399,2026,Systems Biology Approach to Unraveling Transcripto
10.2174/0113862073345094241226112758,1,Scopus,Scopus,Scopus:2-s2.0-105030178113,2026,Study on the Mechanism of Anti-Atopic Dermatitis b
10.2174/0113892002430015251201072618,4,OpenAlex;PubMed;Scopus;WoS,WoS,WoS:WOS:001717196900001,2026,Pharmacological Complexities of Herbal Medicinal E
10.2174/0113892010445359251204044548,4,OpenAlex;PubMed;Scopus;WoS,WoS,WoS:WOS:001685030000001,2026,Application of Traditional Chinese Medicines in Di
10.2174/0115734072401010251128163949,1,OpenAlex,OpenAlex,OpenAlex:W7135151547,2026,Therapeutic Insights into Pain Management: Role of
10.2174/0118750362377947250903082648,1,OpenAlex,OpenAlex,OpenAlex:W7125801383,2026,HDI Corpus: A Dataset for Named Entity Recognition
10.2174/0122103155353712241008060527,1,Scopus,Scopus,Scopus:2-s2.0-105005078612,2026,A Comprehensive Review on the Chinese Herbal Medic
10.25258/ijddt.16.8s.52,1,Scopus,Scopus,Scopus:2-s2.0-105033792371,2026,Incidence and Clinical Impact of Adverse Reactions
10.25258/ijddt.16.9s.92,1,Scopus,Scopus,Scopus:2-s2.0-105033104955,2026,Herbal Drugs Used For Neurodegenerative Diseases: 
10.25259/jksus_1822_2025,1,OpenAlex,OpenAlex,OpenAlex:W7160609053,2026,"Synergistic antibacterial effects of berberine, ba"
10.25259/jksus_9431_2025,1,WoS,WoS,WoS:WOS:001688253500001,2026,Potential pharmacodynamic interactions of losartan
10.25259/jksus_943_2025,1,Scopus,Scopus,Scopus:2-s2.0-105028885951,2026,Potential pharmacodynamic interactions of losartan
10.33483/jfpau.1659355,2,OpenAlex;Scopus,Scopus,Scopus:2-s2.0-105029005059,2026,MODULATION OF CYP1A1 ACTIVITY IN RAT MICROSOMES BY
10.3389/fcimb.2026.1799319,2,PubMed;WoS,WoS,WoS:WOS:001757249200001,2026,The therapeutic potential of epimedium and its bio
10.3389/fcvm.2026.1797330,3,OpenAlex;PubMed;WoS,WoS,WoS:WOS:001752014200001,2026,Myocardial ischemia-reperfusion injury after acute
10.3389/fendo.2026.1709404,1,Scopus,Scopus,Scopus:2-s2.0-105033064253,2026,Traditional Chinese medicine in diabetes managemen
10.3389/fmed.2026.1772991,1,Scopus,Scopus,Scopus:2-s2.0-105032104391,2026,"Integrating network pharmacology, molecular dockin"
10.3389/fnut.2026.1759753,1,OpenAlex,OpenAlex,OpenAlex:W7124729424,2026,Editorial: The role of gut microbiome metabolites 
10.3389/fpain.2026.1727963,4,OpenAlex;PubMed;Scopus;WoS,WoS,WoS:WOS:001722309800001,2026,Integrated multi-omics elucidates the dual anti-in
10.3389/fphar.2025.1676685,3,PubMed;Scopus;WoS,WoS,WoS:WOS:001664387800001,2026,Optimizing phenytoin therapy: a systematic review 
10.3389/fphar.2025.1712917,1,OpenAlex,OpenAlex,OpenAlex:W7119533107,2026,Integrating traditional and herbal medicine into h
10.3389/fphar.2025.1770248,1,OpenAlex,OpenAlex,OpenAlex:W7119127433,2026,Editorial: Combination therapies in cancer treatme
10.3389/fphar.2026.1708101,3,PubMed;Scopus;WoS,WoS,WoS:WOS:001696599100001,2026,Pharmacokinetics and nephrotoxicity of cisplatin m
10.3389/fphar.2026.1718573,1,WoS,WoS,WoS:WOS:001730416900001,2026,Inflammation-neurotrophin synergy of Xiao-yao-san-
10.3389/fphar.2026.1723499,3,PubMed;Scopus;WoS,WoS,WoS:WOS:001718326800001,2026,Uncaria rhynchophylla: an ethnopharmacological rev
10.3389/fphar.2026.1729887,1,Scopus,Scopus,Scopus:2-s2.0-105033659863,2026,Exploring Colombian medicinal flora used in indige
10.3389/fphar.2026.1740454,1,OpenAlex,OpenAlex,OpenAlex:W7134901577,2026,Editorial: Novel anti-cancer agents targeting tumo
10.3389/fphar.2026.1744312,1,Scopus,Scopus,Scopus:2-s2.0-105033970204,2026,Multi-omics analysis reveals the mechanism of Huag
10.3389/fphar.2026.1755093,1,Scopus,Scopus,Scopus:2-s2.0-105029537527,2026,Ginseng and its active compounds in ovarian aging:
10.3389/fphar.2026.1765295,1,Scopus,Scopus,Scopus:2-s2.0-105036983558,2026,HDACs targeting from traditional Chinese medicine:
10.3389/fphar.2026.1779704,1,OpenAlex,OpenAlex,OpenAlex:W7127041978,2026,Editorial: Prevention and treatment of metabolic d
10.3389/fpls.2025.1708851,3,PubMed;Scopus;WoS,WoS,WoS:WOS:001667043900001,2026,Integrated transcriptome and metabolome analyses r
10.3390/app16010481,2,Scopus;WoS,WoS,WoS:WOS:001657185400001,2026,Psychotropic Medicinal Plant Use in Oncology: A Du
10.3390/biom16010007,1,Scopus,Scopus,Scopus:2-s2.0-105028929154,2026,Advances in Bioactive Compounds from Plants and Th
10.3390/biom16010149,1,Scopus,Scopus,Scopus:2-s2.0-105028846073,2026,Antifungal Activity of Natural Thymol: Advances on
10.3390/biomedicines14030516,1,Scopus,Scopus,Scopus:2-s2.0-105034081542,2026,Network Pharmacology and Transcriptome Analysis Re
10.3390/brainsci16020223,3,PubMed;Scopus;WoS,WoS,WoS:WOS:001700634400001,2026,Medicinal Plants for Major Depressive Disorder
10.3390/cancers18030458,4,OpenAlex;PubMed;Scopus;WoS,WoS,WoS:WOS:001687663200001,2026,"Risks, Benefits, and Molecular Targets of Fenugree"
10.3390/cimb48020170,1,Scopus,Scopus,Scopus:2-s2.0-105031359023,2026,Botanical Adjuvants in Oncology: A Review on Natur
10.3390/cimb48020219,1,Scopus,Scopus,Scopus:2-s2.0-105031364629,2026,Research Progress on the Anticancer Effect of Gins
10.3390/ddc5010011,1,OpenAlex,OpenAlex,OpenAlex:W7126427554,2026,Levamisole Potentiation via Thymol and Cinnamaldeh
10.3390/ijms27073310,4,OpenAlex;PubMed;Scopus;WoS,WoS,WoS:WOS:001738674400001,2026,Flavonoid Interactions with Renal Organic Anion Tr
10.3390/info17020138,2,Scopus;WoS,WoS,WoS:WOS:001700333700001,2026,FusionGraphRAG: An Adaptive Retrieval-Augmented Ge
10.3390/jof12010035,3,PubMed;Scopus;WoS,WoS,WoS:WOS:001670632600001,2026,Integrative Genomic and Transcriptomic Analysis of
10.3390/life16010175,4,OpenAlex;PubMed;Scopus;WoS,WoS,WoS:WOS:001671737900001,2026,Medicinal Plants and Phytochemicals in Cardioprote
10.3390/molecules31030410,2,PubMed;Scopus,Scopus,Scopus:2-s2.0-105030209174,2026,Hepatic Sinusoidal Obstruction Syndrome Induced by
10.3390/molecules31040621,1,PubMed,PubMed,PubMed:41752398,2026,Self-Assembled Berberine-Sinapic Acid Nanomedicine
10.3390/nu18040637,1,WoS,WoS,WoS:WOS:001701047600001,2026,Individually Recognized Functional Ingredients of 
10.3390/ph19010027,1,Scopus,Scopus,Scopus:2-s2.0-105029020868,2026,Profiling the Complexity of Resistance Factors in 
10.3390/ph19010111,1,Scopus,Scopus,Scopus:2-s2.0-105028636620,2026,Herba Patriniae Component Linarin Induces Cell Cyc
10.3390/ph19010158,1,Scopus,Scopus,Scopus:2-s2.0-105028566045,2026,Cinobufagin as a Potential Intervention Against Li
10.3390/ph19020246,1,Scopus,Scopus,Scopus:2-s2.0-105031228202,2026,Computational Discovery of Novel SGLT2 Inhibitors 
10.3390/ph19020251,1,Scopus,Scopus,Scopus:2-s2.0-105031365769,2026,Yin-Dan-Ping-Gan Capsule Mitigates CCL4-Induced Li
10.3390/ph19030399,4,OpenAlex;PubMed;Scopus;WoS,WoS,WoS:WOS:001725496300001,2026,Efficacy and Safety of Herbal Supplements with Anx
10.3390/ph19030492,3,PubMed;Scopus;WoS,WoS,WoS:WOS:001725480900001,2026,Berberine-Mediated BCRP Inhibition Enhances System
10.3390/ph19050734,1,OpenAlex,OpenAlex,OpenAlex:W7160487893,2026,Preclinical Pharmacological Actions of Alpinetin a
10.3390/pharmaceutics18020149,3,PubMed;Scopus;WoS,WoS,WoS:WOS:001700157300001,2026,Ginger and Its Purified Major Components Inhibit C
10.34172/jhp.2026.53276,2,OpenAlex;Scopus,Scopus,Scopus:2-s2.0-105026279649,2026,Herbal-derived phytochemicals in hepatocellular ca
10.36721/pjps.2026.39.4.reg.15065.1,1,PubMed,PubMed,PubMed:41761792,2026,Synergistic immunomodulatory effects of Cistanche 
10.3748/wjg.v32.i10.115821,1,Scopus,Scopus,Scopus:2-s2.0-105031962132,2026,Mechanisms and therapeutic potential of traditiona
10.3748/wjg.v32.i4.114420,1,PubMed,PubMed,PubMed:41640866,2026,Synergistic anti-hepatoma effect of triptolide and
10.3791/70673,3,OpenAlex;PubMed;WoS,WoS,WoS:WOS:001743850000019,2026,Computer-Aided Active Ingredients Screening and Va
10.3831/kpi.2026.29.1.84,2,PubMed;Scopus,Scopus,Scopus:2-s2.0-105037854735,2026,Reversing ABCB1-Mediated Multidrug Resistance in C
10.4103/ajio.ajio_2_26,1,OpenAlex,OpenAlex,OpenAlex:W7154596809,2026,From herbs to molecules: Ayurvedic phytoconstituen
10.4103/ajio.ajio_7_26,1,OpenAlex,OpenAlex,OpenAlex:W7154575257,2026,Ayurveda-based supportive management in parotid ma
10.4103/ijp.ijp_234_23,1,Scopus,Scopus,Scopus:2-s2.0-105031715735,2026,Effects of Traditional Chinese Medicine on Restoro
10.5281/zenodo.18150723,1,OpenAlex,OpenAlex,OpenAlex:W7118759693,2026,NATURAL HERBAL AGENTS IN THE REGULATION OF BLOOD G
10.5281/zenodo.18150724,1,OpenAlex,OpenAlex,OpenAlex:W7118975473,2026,NATURAL HERBAL AGENTS IN THE REGULATION OF BLOOD G
10.5281/zenodo.18152691,1,OpenAlex,OpenAlex,OpenAlex:W7118729062,2026,EXPLORING THE ROLE OF HERBAL DRUGS IN NON-COMMUNIC
10.5281/zenodo.18152692,1,OpenAlex,OpenAlex,OpenAlex:W7119024729,2026,EXPLORING THE ROLE OF HERBAL DRUGS IN NON-COMMUNIC
10.5281/zenodo.18255287,1,OpenAlex,OpenAlex,OpenAlex:W7124316873,2026,ZEBRAFISH AS A MODEL FOR HERBAL TOXICOLOGY: A SCIE
10.5281/zenodo.18255288,1,OpenAlex,OpenAlex,OpenAlex:W7124305256,2026,ZEBRAFISH AS A MODEL FOR HERBAL TOXICOLOGY: A SCIE
10.5281/zenodo.18302433,1,OpenAlex,OpenAlex,OpenAlex:W7124701772,2026,Traditional Medicine in Palliative Care: An Ayurve
10.5281/zenodo.18302434,1,OpenAlex,OpenAlex,OpenAlex:W7124757956,2026,Traditional Medicine in Palliative Care: An Ayurve
10.5281/zenodo.18428706,1,OpenAlex,OpenAlex,OpenAlex:W7126186422,2026,NATURAL PLANTS FOR IMMUNE SYSTEM ENHANCEMENT
10.5281/zenodo.18428707,1,OpenAlex,OpenAlex,OpenAlex:W7126208008,2026,NATURAL PLANTS FOR IMMUNE SYSTEM ENHANCEMENT
10.5281/zenodo.18875320,1,OpenAlex,OpenAlex,OpenAlex:W7133694969,2026,ROLE OF HERBAL MEDICINE IN MODERN HEALTH CARE: EMP
10.5281/zenodo.18875321,1,OpenAlex,OpenAlex,OpenAlex:W7133914292,2026,ROLE OF HERBAL MEDICINE IN MODERN HEALTH CARE: EMP
10.5281/zenodo.19218362,1,OpenAlex,OpenAlex,OpenAlex:W7140305048,2026,A COMPREHENSIVE GLOBAL REVIEW OF RENAL TOXICITY AS
10.5281/zenodo.19218363,1,OpenAlex,OpenAlex,OpenAlex:W7140289780,2026,A COMPREHENSIVE GLOBAL REVIEW OF RENAL TOXICITY AS
10.5281/zenodo.19325977,1,OpenAlex,OpenAlex,OpenAlex:W7143334511,2026,Utilization of Herbal Medicines for Disease Manage
10.5281/zenodo.19325978,1,OpenAlex,OpenAlex,OpenAlex:W7143422202,2026,Utilization of Herbal Medicines for Disease Manage
10.5281/zenodo.19413796,1,OpenAlex,OpenAlex,OpenAlex:W7149387842,2026,"NIGELLA SATIVA IN MODERN HEALTHCARE: PHARMACOLOGY,"
10.5281/zenodo.19413797,1,OpenAlex,OpenAlex,OpenAlex:W7149649818,2026,"NIGELLA SATIVA IN MODERN HEALTHCARE: PHARMACOLOGY,"
10.5281/zenodo.19414601,1,OpenAlex,OpenAlex,OpenAlex:W7149652624,2026,"""A COMPUTATIONAL FRAMEWORK FOR MODERN HERBAL DRUG "
10.5281/zenodo.19414602,1,OpenAlex,OpenAlex,OpenAlex:W7149367610,2026,"""A COMPUTATIONAL FRAMEWORK FOR MODERN HERBAL DRUG "
10.5281/zenodo.19533357,1,OpenAlex,OpenAlex,OpenAlex:W7153769754,2026,TRANSLATIONAL SUPPORT & PREVENTIVE PROTOCOLS: brid
10.5281/zenodo.19533358,1,OpenAlex,OpenAlex,OpenAlex:W7153742824,2026,TRANSLATIONAL SUPPORT & PREVENTIVE PROTOCOLS: brid
10.5281/zenodo.19740145,1,OpenAlex,OpenAlex,OpenAlex:W7155536501,2026,STRESS AND ANXIETY AND THE USE OF HERBAL REMEDIES:
10.5281/zenodo.19740146,1,OpenAlex,OpenAlex,OpenAlex:W7155568490,2026,STRESS AND ANXIETY AND THE USE OF HERBAL REMEDIES:
10.5306/wjco.v17.i3.116534,1,WoS,WoS,WoS:WOS:001732556400013,2026,Adjuvant role of traditional Chinese medicine in p
10.53388/tmr20240920001,2,Scopus;WoS,WoS,WoS:WOS:001570863300001,2026,Therapeutic potential of traditional Chinese medic
10.53388/tmr20250114002,2,Scopus;WoS,WoS,WoS:WOS:001656685400007,2026,Qi deficiency syndrome in heart failure: integrati
10.53941/ijddp.2026.100001,1,Scopus,Scopus,Scopus:2-s2.0-105034981433,2026,Natural Products Targeting GLP-1: Insights into He
10.5455/ajvs.308619,1,Scopus,Scopus,Scopus:2-s2.0-105037327991,2026,Effect of Nigella sativa Extract on Pharmacokineti
10.5530/ijper.20267022,2,Scopus;WoS,WoS,WoS:WOS:001686042500002,2026,Herb-Drug Interaction Evaluation on Concomitant Ad
10.5530/pres.20260034,1,WoS,WoS,WoS:WOS:001667358600001,2026,Natural Compounds in Hepatic Protection and Injury
10.56499/jppres_14.2.2405,2,Scopus;WoS,WoS,WoS:WOS:001709701000001,2026,Adverse events and potential herb-drug interaction
10.56975/jaafr.v4i4.507652,1,OpenAlex,OpenAlex,OpenAlex:W7155509395,2026,Herbal remedies for depression and anxiety
10.7324/japs.2025.240961,1,Scopus,Scopus,Scopus:2-s2.0-105026719387,2026,Network pharmacology and molecular dynamics studie
10.7759/cureus.106016,2,OpenAlex;PubMed,PubMed,PubMed:42051846,2026,Kratom Consumption Associated With Herb-Induced Li
10.9734/jabb/2026/v29i33712,1,OpenAlex,OpenAlex,OpenAlex:W7132843114,2026,Recent Developments in Antioxidant and Anti-inflam
